name,tagline,pos_x,pos_y,team_size
Vitalize,The OS for Hospital Operations,0.3970022,0.67218125,14
Hona,The Domino's Pizza Tracker for lawyers and their clients.,0.42287636,0.37492093,64
Noya Software,Product design tool that lets everyone design like a designer,0.48271045,0.40774286,2
Infinia,Real Time Payments infraestructure,0.29595354,0.38783374,3
Finic,AI-Native Fincrime Platform,0.774847,0.47598916,2
Honeydew,The home for shared data logic,0.58619833,0.36474806,6
Radical,"Building persistent, high-performance infrastructure in the sky",0.48805177,0.535182,7
Koywe,Crypto On and Off Ramp for Latam,0.25391984,0.38073146,7
Sherloq,"One place for all your queries, directly on your SQL editor",0.5529406,0.39193758,6
Hippo Scribe,AI assisted documentation for PT/OT/SLP,0.6547598,0.451158,2
Shortbread,Read romance comics.,0.46384874,0.4835418,4
SPRX,AI for corporate R&D tax credits,0.7581739,0.50703776,32
Sirdab,Cloud warehousing & supply chain platform in MENA,0.34916657,0.48568648,0
Pointwise,App that tells you which credit cards to get and when,0.30973443,0.36895037,3
Sage AI,"Your self-generating, self-maintaining code knowledge base.",0.5440047,0.39583117,2
Hadrius,Automating Securities Compliance,0.7694936,0.46320006,19
Defog.ai,Fine-tuned LLMs for enterprise data analysis,0.58806014,0.36828208,5
Fiber,We help developers pull data from popular APIs to build integrations,0.5170322,0.32650018,4
Fintool,Financial copilot for institutional investors,0.3178576,0.34234574,6
ClickPe,Finance on a Click,0.32480535,0.34575385,2
Boundary,"Function calling that's cheaper, faster, and better, on every model",0.53504795,0.37413225,3
compliant-llm,Detect Gen AI security risks in real-time,0.6623739,0.4136137,3
222,marketplace facilitating IRL social experiences at local venues,0.4079578,0.42413756,6
Ariglad,Knowledge base maintenance on auto-pilot,0.57128215,0.3960653,4
Variance,World-Class Tooling for Trust & Safety teams,0.61666226,0.3469465,8
Helicone,LLM Observability for Developers,0.58816755,0.3193718,5
Rainmaker,DeFi for Everyone,0.48149264,0.40964526,2
Storyboarder,Tool and platform to create and sell webcomics,0.45744926,0.43319792,2
Logital AI (Teclada),Compare models and ouputs without random noise skewing your results.,0.56624395,0.4284462,2
Homeflow,Simplifying insurance for large real estate investors,0.29540154,0.59833485,4
Berilium,Invest in top Private Equity and Private Credit starting at $10k,0.31221318,0.35829058,3
Orchid,AI-powered EHR for independent mental health professionals,0.40403807,0.72148865,4
IcePanel,Design and explain complex software architecture.,0.5426803,0.3731132,6
Forfeit,An app that takes your money if you don't complete your habits.,0.29936916,0.3692793,2
TableFlow,AI Document Processing,0.6472242,0.43974024,2
BuildJet,High-performance computing cloud,0.5920382,0.3439453,2
Truewind,AI-Powered Accounting,0.7665074,0.5023047,30
Wild Moose,Automating root cause analysis with generative AI,0.655849,0.44025618,3
Velos,Platform to automate manual back-office work,0.61265707,0.40626156,3
EzDubs,Real-time speech translation,0.554298,0.4691692,6
Plutis,,0.0049513234,0.90671575,2
ShortLoop,AI Phone Agents For Your Business,0.771824,0.52329254,5
Inkeep,AI support you can trust.,0.7335839,0.48406148,9
RUUF,Managed marketplace for solar in Latam,0.26059878,0.4572344,23
OpenMeter,"Usage Metering, AI & API Monetization",0.7320242,0.50847906,7
Iliad,"Create stylized art, textures, and 3D assets with AI.",0.629524,0.4903853,1
Relace,LLMs for Code Generation,0.5779914,0.33716577,3
co.dev,Turn your ideas into full-stack apps,0.51183313,0.34664035,2
Propexo,Plaid for Commercial Real Estate,0.33603117,0.43217143,6
Floworks,Hire the best AI Sales employees | AI SDR | AI RevOps | AI EA,0.7249679,0.5065494,20
1stCollab,Performance-Optimized Influencer Marketing,0.43235552,0.34539425,6
Langfuse,Open source LLM engineering platform,0.57859915,0.31915522,8
TruthSuite,AI Fact Checking for Lawyers,0.7649463,0.4647515,4
Dream3D,Generative AI Worlds,0.66161776,0.45926037,3
Bluedot,Bluedot is a single payment platform for EV drivers and fleets.,0.43317676,0.52513576,11
Extend,The Modern Document Processing Cloud,0.5948068,0.37590364,13
No Cap,"AI startup investor, No Cap",0.32624716,0.32680857,5
Haven,AI workforce for property management,0.7415077,0.538873,3
Frigade,AI-powered product assistance for modern software teams,0.7102179,0.4840279,4
Cobblestone,Delinquency reduction and automation software for institutional…,0.6066005,0.3716135,3
Suger,"Salesforce for Cloud marketplaces on AWS, Azure, GCP",0.5639677,0.32251397,50
coil inc.,ai,0.6699147,0.45260173,1
Kivo Health,AI-powered virtual care for chronic lung disease,0.39835373,0.71481454,25
Polo,Building restaurant software that works.,0.37587816,0.45918933,5
Athina AI,"Prototype, Experiment & Evaluate AI Pipelines in a Spreadsheet-like UI",0.6651704,0.45785838,5
Repacket,Employee security done for you.,0.40249273,0.38757047,4
Cloudchipr,Workflow Automation for Cloud Operations,0.6146884,0.4053148,8
Chart,Realtime Access to Verified Tax Records,0.3463901,0.342745,3
Bujeti,Corporate cards and expenses management platform for African…,0.28796992,0.3906982,10
Index,Powerful planning for Product Management,0.55919856,0.45111936,4
Cosine,Fully Agentic SWE,0.6952116,0.42910218,12
Flower,Train AI on distributed data,0.6768817,0.4467965,20
Pirros,Github for Construction,0.5346884,0.37313864,21
Trigo,Rent verification API for landlords and lenders,0.30901602,0.33103308,4
Bluebirds,Automate outbound with signals,0.55441505,0.47797447,6
Scanbase,"The API for Diagnostic Test Analysis (COVID-19, FLU, RSV, STD,…",0.36502185,0.67049253,10
Vooma,Automation platform for logistics,0.6339919,0.55445653,3
Coperniq,Workflow software for solar & energy contractors ☀️😎,0.45328015,0.53899086,6
PoplarML,Deploy Machine Learning Models with One Command,0.61485237,0.41566816,2
LaunchFlow,AI Agent for Terraform: infra.new,0.7075412,0.46187392,3
GovEagle,First draft of a government RFP response in 60 min,0.4497103,0.41100645,10
FlexWash,The operating system for the car wash industry.,0.42112124,0.4579496,2
Gluetrail,Create step by step articles with screenshots and videos 10x faster,0.5115982,0.42941278,2
OfOne,AI-powered order taker for restaurant drive-thrus,0.6972559,0.54371035,5
Narrative,AI-powered QA testing platform,0.666071,0.4449241,7
Dataglade,The smart way to research stocks.,0.3228064,0.35024092,2
JustPaid.ai,Delightful AI rev ops.,0.6950924,0.46913078,15
EdgeBit,Autofix your software dependencies,0.5606205,0.3497968,5
Tennr,"Fast, Transparent Patient Experiences",0.40082347,0.66478616,85
Salient,AI Servicing for Auto Lenders,0.7659587,0.5218893,16
ZeroDev,Account abstraction wallets as a service,0.25863972,0.33480445,5
Ruby Card,Neobank for e-commerce businesses,0.26352504,0.3870751,3
LinkGrep,AI browser copilot for teams,0.66856956,0.47332072,2
Pledge Health,AI RCM assistant that handles any insurance task on payer portals for…,0.40906528,0.7567262,2
Omnistrate,Transform any software to multi-cloud SaaS in minutes not years,0.5535068,0.31623408,15
Cakework,API that adds cloud hosting to any developer platform,0.5480505,0.3124723,2
Double – Coding Copilot,AI coding copilot engineered for performance,0.6290173,0.4882253,2
Versive,AI-first user research platform,0.6829654,0.47110593,3
Glass Health,AI-Powered Clinical Decision Support,0.39211106,0.71933156,2
Mercoa,AI Agent for Billpay platforms to pay invoices with virtual cards,0.7643823,0.5134753,2
Ohm,AI agents for battery teams,0.71922886,0.47543737,6
Pair AI,Reimagining education with short form video and AI,0.60038596,0.46307287,2
Nango,A single API for all your integrations,0.5368421,0.31951573,6
Palomma,AI Agents for Residential Property Managers & Real Estate Developers,0.755808,0.5380517,8
Numeral,SaaS & Ecommerce sales tax on autopilot. ,0.3806979,0.35313907,50
FlexDesk,One platform for corporate occupiers to manage their office portfolios,0.4438021,0.35648847,8
Trackstar,Plaid for supply chain logistics,0.34858423,0.48531857,6
Pyq AI,AI automation for insurance brokerages,0.41111252,0.7654218,2
Latent,Medical language models to automate healthcare operations,0.40207425,0.70615244,30
Concourse,AI Agents for corporate finance teams,0.7683355,0.498802,6
Hammr,Rippling for the Construction Industry,0.42953736,0.5030105,9
Backdrop,"Vertical SaaS for $650B+ Film, TV, Music & Event Production Industry ",0.4102385,0.3592553,2
SelectIQ,Empowering every doctor and every patient to participate in research,0.3644521,0.64217323,2
Lume,Speed up customer implementation with AI,0.73298174,0.51884675,5
Pigeon,"Document collection made fast, easy, and secure",0.5880315,0.37095228,5
Rollstack,Automate data-driven slide decks and documents with AI,0.6516271,0.44477698,25
Credal.ai,Harness Frontier Intelligence by building AI assistants that can…,0.7041558,0.46867672,12
Depot,Build faster. Waste less time.,0.44069093,0.44656977,8
Magic Patterns,Prototype your product ideas with AI.,0.67445153,0.4944797,2
Syncly,AI to auto-analyze all your customer communications,0.72991395,0.51952773,9
Layup,Guide your users. Right in your product.,0.42683563,0.3759753,3
rift,The sales platform built to help you focus,0.40292582,0.38073745,8
Trigger.dev,Open source background jobs & AI infrastructure,0.66200393,0.45134172,6
Versori,Agentic integrations & automations for enterprise,0.73435867,0.44446605,16
Traceloop,Know what your LLM is doing — and why it’s failing,0.5759985,0.3426519,9
Matano,Cloud Native SIEM (alternative to Splunk/Elastic),0.5764524,0.34328276,2
OneText,Frictionless payments via SMS,0.29244402,0.3705448,6
Designbase,Design and build great interfaces,0.5098152,0.37482548,3
Linum,"type text, dream video",0.51573807,0.46902588,2
Laminate,,0.0066349297,0.9058324,0
StackAI,AI Agents for the Enterprise,0.7266844,0.45512158,21
Finvest,Easy way to buy US Treasury Bills,0.3012311,0.37292063,5
Reflex,Web apps in pure Python. Deploy with a single command.,0.5310856,0.3361575,8
Miracle,"Accelerate clinical trials with real-time, actionable insights",0.36881313,0.6897798,5
Middleware,AI-based full stack observability platform,0.6049428,0.3461101,40
Infisical,Open-source secrets manager for developers,0.5956836,0.3271509,15
Avoca,AI-powered Sales Agent for Service-Based Industries,0.72192764,0.51678824,7
DrDroid,Your best friend in production.,0.4575767,0.470647,8
Rubbrband,Storyboard with AI,0.6656165,0.45525444,3
LazyEditor,AI Agentic Video Editor,0.6221825,0.4877957,3
Chima,Building infrastructure tools to help large companies customize their…,0.49337694,0.361171,7
Lavo Life Sciences,AI for drug formulation,0.329879,0.7072694,3
Sameday,AI sales agents for home service businesses,0.7380142,0.5249429,7
highlight.io,"The open source, fullstack monitoring platform: stop guessing why…",0.57353497,0.33567455,8
AlphaWatch AI,Agentic search for enterprises with trusted data,0.7033014,0.40566963,7
Keep,The open-source AIOps platform,0.6738239,0.4647871,5
Unify,Take Back Control of Your LLM ✨,0.42265084,0.40886948,10
DAGWorks Inc.,Open source tools & services for reliable AI Agents & AI Applications,0.7048175,0.44264558,2
Booth AI,Generative AI Photographer for E-Commerce,0.6733865,0.5080172,3
PlayAI,Our mission is to make Voice AI accessible and useful to all.,0.4618119,0.47748673,35
Fairway Health,AI Co-Pilot for Health Insurers to Authorize Treatment Faster,0.40625337,0.7475458,3
Outerbase,The interface for your database,0.56300545,0.3821399,4
Dashdive,Break down AI and cloud costs by feature and customer,0.7343683,0.51963603,2
Brewit,Conversational data analytics for every team,0.5308492,0.38935763,4
Viddy,A new way to create landing pages that is video-native.,0.5048797,0.44761744,2
Upfront,A personal assistant for every homeowner,0.40625238,0.46221122,4
Second,AI-Native Enterprise Codebase Maintenance,0.6989222,0.44164366,3
Serial,Root cause manufacturing issues in seconds,0.42513937,0.49345556,2
Interlock,We are still in stealth mode.,0.4372359,0.47356614,2
CodeParrot AI,Helps Developers build stunning UI Lightning Fast ⚡️,0.5092342,0.36011887,2
Defer,Zero infrastructure background processing platform.,0.5582819,0.41103813,2
Luca,The Modern Pricing Engine for Retail,0.38408366,0.40113112,6
Sorted,Instant SaaS management,0.46344018,0.3225996,2
Echo,Founder-led sales co-pilot for B2B startups.,0.43143666,0.38458356,3
SensorSurf,Resolve PR check failures instantly with AI,0.68317646,0.44263527,1
OutSail Technologies,"Revolutionary, Modern Wing Sails",0.48994794,0.5503288,3
Cardinal,Your AI product backlog,0.69691795,0.4811414,3
Magicflow 𐂂,The Gen AI evaluation and curation platform,0.6609376,0.45368457,2
GoodCourse,The TikTok style corporate training platform,0.45902517,0.39176187,8
CreatorML,Foundation Model for Human Attention,0.5699541,0.4482219,6
Overflux,Streamline EV charger installations for real estate developers,0.45384148,0.54504406,2
Rubber Ducky Labs,AI Powered Product Discovery,0.6779896,0.51065385,2
Parabolic,AI assistant for customer support,0.74513376,0.5107231,2
Neptyne,The programmable spreadsheet.,0.58474076,0.39624047,4
Lynx,AI platform for investigating and resolving engineering incidents,0.6578387,0.47956526,5
Demospace,,0.006689404,0.9058112,2
Indexical,AI-powered data extraction engine,0.6541244,0.43718576,2
Choppy!,FAST FLAVORFUL PROTEIN,0.3695158,0.55739367,2
Paperplane,Credit risk management platform for builders' merchants,0.31805843,0.3536262,5
Struct,Multi-lingual AI Voice Agents,0.71712774,0.56407905,3
Morf Health,Workflow automation for healthcare providers,0.40288857,0.7021727,6
Polymath Robotics,General Autonomy for Industrial Vehicles,0.549631,0.5438829,11
Ping,The global neo-bank for contractors and freelancers,0.25934026,0.38370457,20
Materee,E-commerce platform for construction materials in Indonesia,0.3511737,0.42840135,20
Integrated Reasoning,Faster processors for solving NP-complete problems,0.6138332,0.41487342,1
Guardian Bio,Dendritic cell-based platform for cancer therapy ,0.3241874,0.6661943,2
Blyss,End-to-end encrypted AI.,0.6532793,0.3918191,2
Coverage Cat,Consumer Optimized Insurance,0.2965743,0.5992084,4
Mogara,Automatic software R&D capitalization ,0.59202814,0.39355204,2
AccessOwl,Managing your Employees' Access to SaaS,0.4539185,0.3289627,4
Cone,Work operating system for professional service businesses,0.4212439,0.4373556,8
Intuned,Reliably integrate with websites that don’t have official APIs,0.53780514,0.32057464,7
OpenSight,AI-powered customer support automation for fast-growing companies,0.7450283,0.52290314,3
Landeed,Landeed is India's fastest property title search engine ,0.35629496,0.42196786,35
Axle,Universal API for insurance,0.32206255,0.62751573,10
Aldara,HOA manager with automated operations,0.3828765,0.43565604,10
Cambio,Real estate capital planning and compliance made simple,0.3339567,0.4167728,16
InVision Medical Technology,AI Diagnosis of  Heart Disease,0.3888633,0.7146611,2
Kamion,Uber for Trucks for Turkey,0.37855765,0.49506754,35
Shelf,Neobank for Young Professionals in India,0.25932616,0.39205912,2
Delfino AI,Generative AI for administrative automation in healthcare ,0.40316314,0.72985166,2
Kashin,Credit for the emerging economy in Latam,0.2569784,0.42203,45
Velontra,Hypersonic space plane that can take-off from any location and weather,0.5078895,0.5560771,5
AlgoTest,Ecosystem for options trading in India,0.29734567,0.35791525,12
REVER,Changing the way people buy by giving superpowers to shoppers,0.36657,0.44043943,35
Sculpt,Fully automated should-cost analysis for precision manufacturers.,0.5778025,0.4437341,2
Knowtex,Making doctors 2x more efficient with AI note-taking & charge capture,0.40260115,0.7340504,0
MovingLake,Realtime Data Connectors,0.5591638,0.356568,3
uwi,Private credit solutions for Southeast Asia’s housing backlog ,0.31401008,0.38584462,14
Lancey,Multiplayer agents for your engineering team,0.71154034,0.43132895,5
Jamble,Fashion resale marketplace powered by live streaming and video,0.40003923,0.45372117,3
Pump.co,The Costco for cloud is here 🔥🔥,0.3887686,0.47161156,60
Taro,On-demand career courses for software engineers,0.5268098,0.39561602,5
Relevium Medical,Platform injectable gel based therapeutic for osteoarthritis,0.34104648,0.65248597,5
Blockscope,Palantir for Web3,0.5032115,0.34830907,4
Entvin,,0.010058155,0.90364254,5
Wondercraft,Canva for Audio,0.47979772,0.46453065,15
autone,Inventory management SaaS for Retail & Consumer brands,0.38659418,0.40789965,70
Oneleet,"YC's most popular security compliance platform (SOC 2, ISO 27001,…",0.6189405,0.3335551,50
Krave Mart,Grocery Delivery in Pakistan,0.32168025,0.49414048,80
Drahim 💰,WealthFront for Saudi & Middle East,0.30484623,0.37155914,8
Almond,We make it easy to get great ObGyn care  in-person and over telehealth,0.3625642,0.62165344,8
Jasmine Energy,Claim solar incentives with AI,0.7443658,0.5011412,5
Solum Health,AI Automation for Therapy Practices,0.3946639,0.7179861,3
Levers,Automating collection and boosting cashflow for B2B companies,0.3230384,0.35690194,8
FoodCourt,Virtual Restaurants & Stores for Africa,0.3210261,0.4584433,80
Superbar,Search & Answers Superbar for E-Commerce,0.3924902,0.40237647,3
Sunpia,Deploy serverless without rewriting code,0.55045027,0.32193387,3
Firecrawl,The easiest way to extract AI ready data from the web,0.6633861,0.4278666,9
TypeLess,"AI messaging API for smarter, faster communication.",0.73560184,0.47026116,2
Invofox,INVOFOX is the document processing AI for software companies,0.63148046,0.42040667,12
Avina,GTM signals engine for sales teams. Automate warm outbound with AI.,0.70556486,0.505053,5
KemNet,KemNet supplies reformulated drugs for specific groups of patients.,0.36040404,0.6273962,2
Boton,Accounting software with an AI agent,0.7664539,0.50563353,3
Patika,Automating entry of sales orders from emails/Whatsapp into ERP…,0.43319434,0.33047894,5
PrimeVault,"Supercharged crypto operations, custody and risk management",0.2607814,0.33151087,3
HOMLI,Modern real estate brokerage for Europe,0.32694346,0.40531227,20
Findly,Co-pilot for Business Intelligence,0.56672627,0.39839932,11
nsave,Trusted $€£ accounts abroad for people from unstable economies.,0.28568047,0.38067433,15
Relate,All-in-One Sales and Marketing CRM for B2B teams,0.4355425,0.33181873,7
Relay Health,Peer support to overcome addiction – the modern AA ,0.39972505,0.63067645,5
Lamin,Open data platform for biology,0.31598073,0.6993917,6
Trendex - We Tokenize Talent,Turning billions of fans into participants in the journey of…,0.45288262,0.47302982,9
Roforco,Creating viral AI consumer apps and games,0.683215,0.4657629,4
AiPrise,Global KYC and KYB Platform ,0.2734319,0.34719896,20
Wand Solar,We enable landlords to generate income from solar panels.,0.42035493,0.54178816,2
Blacktop Hoops by Vinci Games,Take Two Interactive for VR games. ,0.4967957,0.475946,7
Anchor,Embedded finance platform for African businesses,0.29646236,0.3402706,8
CompUp,Building a compensation graph to help companies optimise people spend,0.33981517,0.35944104,35
Plutto,Verify and validate business customers in minutes for LatAm.,0.25138134,0.4436051,12
Ekho,"Enabling OEMs, distributors, and dealers to sell more vehicles in the…",0.37807384,0.4864646,10
Unthread,Agentic service management in Slack,0.7156727,0.41222572,7
Kombo,"Unified API for HR, payroll and recruiting software",0.44971326,0.34617275,20
Accountable,Smarter spending for vacation rental managers,0.34565267,0.38896534,2
Artemis Search,A search technology that actually finds what you’re looking for.,0.4814511,0.42216808,3
Feather,AI Employees for the Mortgage Industry,0.76116323,0.51237416,2
Cobbery,Fixing senior care,0.37709278,0.61792296,4
Fini,Fini | Automate 80% of enterprise support with AI agents,0.7423895,0.46343276,14
Metriport,Open-Source Platform for Healthcare Data Intelligence,0.37691677,0.68379575,11
Garage,Auto parts marketplace for Africa,0.3258346,0.4621557,54
iollo,AI platform accelerating therapeutic R&D from years to days.,0.3442554,0.7083657,4
Aurelian,Automating non-emergency calls for 911 centers,0.62171495,0.39519015,11
Maya Labs,Building self-programming machines,0.6581056,0.45719236,5
FlyCode,Recover failed subscription payments to increase retention and LTV,0.37679788,0.37620962,7
Pluralith,Automated infrastructure compliance and documentation,0.6003879,0.3885608,2
Diversion,"A scalable, cloud-native Perforce and Git alternative",0.5710677,0.32395548,14
AviaryAI,Outbound AI voice agents for the financial services industry,0.7567881,0.54164124,8
Hedgehog,Building robotic mushroom farms,0.5760278,0.55402917,4
Mintplex Labs,Building the definitive all-in-one on-device AI tool suite,0.655587,0.47140327,3
Latent Space,Applied AI for The Emerging Economies,0.73117536,0.4939582,40
Coris,"AI-powered risk platform for Payment Providers, Banks, SaaS platforms…",0.7808058,0.47606716,9
Quindar,The platform to monitor and automate satellite operations,0.5931042,0.35735786,30
Bitstack,"All things money, with better money",0.3108862,0.37440166,16
Airhart Aeronautics,Airplanes anyone can fly,0.50016314,0.55412304,6
Peoplebox,"OKR, Performance and Engagement tool integrated with your worktools",0.5132288,0.3658209,35
Shipmates,Shipping platform for online merchants in the Philippines,0.34309492,0.45468202,12
Neosync,Neosync is an open-source anonymization and synthetic data platform.,0.6290505,0.35488325,3
Pulppo,Shopify for Real Estate Agents in LATAM,0.25701827,0.4518471,29
100x,"Create, Share, and Monetize AI Agents",0.7012315,0.43666056,3
Thera,Financial OS for SMBs,0.3186943,0.33133212,12
NewsCatcher,News API for risk and data teams,0.54869866,0.38336384,18
Provision,Ironclad for construction,0.46048224,0.5145229,9
Chowdeck,On-demand food delivery for Africa,0.31056112,0.45931014,14
Typewise,Boosting customer service and sales productivity by 2-3x.,0.41542247,0.3837232,12
Sytex,Project management platform for Field Infrastructure.,0.50795263,0.34321904,22
Slidely AI,AI-powered PowerPoint add-in to make beautiful presentations faster.,0.62497497,0.4536871,2
Flair Labs,The world's first digital concierge for real estate and lending,0.3234114,0.39646846,4
Namecard.ai,AI-powered business matchmaking,0.7202747,0.50512785,9
Aragorn AI,Operating system for HR in the AI era,0.70574164,0.48982862,4
Zapi,AI Copilot for Product Teams,0.7075604,0.49680275,2
Malama Health,Doula-led holistic support during and after pregnancy ,0.37213978,0.62603045,3
BiggerPicture,Scheduling automation platform between trucking and warehousing ,0.6374186,0.56067216,5
Pivot,Your AI FP&A Analyst,0.71732086,0.48557413,2
Phind,AI search engine,0.6774755,0.45824316,4
Hype,"Trade memecoins, news, trends",0.31487337,0.38483125,3
Ten Lives,Decarbonizing food proteins with AI.,0.39029562,0.58027405,6
Maverick Metals,Expanding Metal Production,0.42486775,0.5143463,20
Illuminant Surgical,A new way of seeing inside the human body.,0.38627088,0.6376155,8
Apply Design,Helping realtors showcase the full potential of their properties,0.34226558,0.4137195,9
Evoly,Smart electric & water meters as a service,0.44040707,0.5256011,4
Tank Payments,Modern financial infrastructure for the trucking industry.,0.38324863,0.4920804,7
Juicebox,AI-powered talent sourcing for recruiters,0.7105941,0.49745688,14
Popsy,AI tool that finds you leads on Reddit and sends them hyper…,0.45461404,0.32729775,2
Capix,AI-powered private equity intelligence.,0.7871103,0.5017377,5
Windmill,Open-source platform to turn scripts into internal apps & workflows,0.5418352,0.33666274,10
Activepieces,"Open-source, AI-first and no-code business automation tool",0.69246733,0.4681423,10
Seaflight Technologies,We make the world's most efficient aircraft,0.4893282,0.5487319,4
Cashboard,Inventing the solo CFO.,0.3387848,0.34485263,6
Rio,LATAM’s largest stablecoin FX and liquidity provider,0.25033674,0.38542718,10
CodeCrafters,Programming courses for experienced engineers,0.5293866,0.4132293,10
Gullak Money,Gullak automates savings & invests these in gold,0.3126012,0.37483877,15
Blee,"Smart, fast, and collaborative compliance reviews ",0.5998068,0.3766665,6
Raven,AI Assistants for Manufacturing Operations,0.65853804,0.5205566,4
ALT TEX,"Biodegradable and carbon neutral textiles, engineered from food waste.",0.4032393,0.5594508,10
Overwatch,"Enterprise software for strategic, risk, and cyber fraud intelligence",0.62837493,0.35098228,5
Disclo,Health disclosure and accommodation management platform,0.37406677,0.66441226,10
Voltic,Electric cargo ships,0.47533426,0.5560556,5
IvyCheck,Clean and enrich your data 10x faster,0.5692427,0.36334917,2
Lyra,Spend crypto anywhere online,0.2599921,0.3577746,3
Sunlight,The Universal Card-On-File API,0.5789137,0.35596913,6
Novig,America's #1 Sports Prediction Market,0.37116718,0.36373422,30
Signatur Biosciences,Simple tests for complex diseases.,0.36284885,0.6652526,5
NuMind,Create custom NLP models,0.5977246,0.423284,6
EthosX,The protocol for derivatives on blockchains,0.26126415,0.3323671,2
Ballerine,Open-source KYC and risk management infrastructure,0.26628193,0.33033106,3
Paragon AI,"Turns your sales calls into CRM data, automatically.",0.44079706,0.33192244,3
Craze,"All-in-one Payroll, HR and IT for India",0.34662783,0.37347683,8
Boostly,Gamified marketing for restaurants,0.36462614,0.45319626,50
BlueHill Payments,Expanding Payment Flexibility and Lowering Rates for Merchants,0.3098007,0.38119414,2
Dr. Treat,“One Medical for pets.”,0.37478,0.6262947,21
Fetii,"Fetii transports groups and businesses together, on-demand",0.42796177,0.3955093,6
Array Labs,We're building satellites to create a real-time 3D map of the world.,0.49700692,0.5287968,0
Champ,"Best Outbound AI SDR in the world. More sales deals, no human needed,…",0.6707881,0.50054044,10
