name,tagline,pos_x,pos_y,team_size
Ziina,A digital wallet for the Middle East & North Africa,0.26628122,0.37395233,25
Zealth,Software for remote monitoring of cancer patients,0.38726848,0.65762985,2
Alokai,Frontend Platform for eCommerce,0.43017524,0.38331014,100
Infracost,Shift FinOps Left: Proactively Find & Fix Cloud Cost Issues,0.5707323,0.32079458,11
Houm,All-in-one real estate marketplace for Latin America,0.34045097,0.4097877,400
Mono,"Plaid for Africa, but better. ",0.3169146,0.43665537,10
Morada Uno,We underwrite and insure house rentals in Latam ,0.27474812,0.44083372,50
Z1,Digital bank for teenagers in LatAm connected to prepaid card ,0.25479114,0.40297702,80
Haystack,Delivery Analytics for Software Teams,0.53397655,0.36444944,6
Mendel,Workflows to empower employees to spend while finance stay in control,0.32286358,0.36042947,5
Soraban,AI assistant for accounting firms ,0.7636895,0.5005202,50
Ontop,Simplifying hiring and payments for the global workforce,0.35167515,0.367923,192
Stayflexi,Operating System for Hotels and Vacation Rentals,0.41040316,0.43542808,43
Lamar Health,Scaling Intelligence for Healthcare Automations,0.40472147,0.72358924,6
Compose.ai,Cut your writing time by 40% with AI-powered autocomplete,0.55119,0.41419658,7
Manara,Connecting top Middle East talent to global tech jobs,0.48670292,0.40434894,10
Biodock,Cloud AI microscopy automation,0.6083771,0.50610405,8
Venu AI,Meet qualified leads in person by automating conference production,0.7197881,0.4635345,5
Betterhalf,India’s first and only marriage super app,0.38095155,0.45891464,25
Feroot Security,"AI-powered Compliance Platform for PCI 4, CCPA, HIPAA, CIPA, 50+ laws",0.75301355,0.48016733,24
Camp,A Nouns DAO governance client,0.4436636,0.42294502,3
Roger,The Best Way to Sign Contracts Since Handshakes. Roger that.,0.380737,0.40146378,4
Phoenix,Canada's digital health clinic for men,0.4032901,0.6527285,50
Seer,Sell beyond the store.,0.3796713,0.42410326,4
Redcliffe Lifetech,Redcliffe Labs is India's Largest Omni-channel Diagnostics platform ,0.36882693,0.5918269,3500
FitHub,The one-stop shop for healthy products,0.36121118,0.49485514,60
Rulebricks,Add powerful decision-making capabilities to any automated workflow.,0.5582345,0.47300205,2
Reclaim Protocol,Industry's first sub-dollar user data verification company!,0.6280417,0.3398499,26
Tint,Makes it easy for tech platforms to embed insurance into products,0.30064395,0.60708904,40
ZOKO,Better Business on WhatsApp,0.41280887,0.4033496,18
Unschool,"Learn, Intern and become Industry-Ready",0.50290924,0.41329935,35
Sturdy,DeFi protocol for permissionless lending,0.2968302,0.32883748,11
Striga,Compliant Crypto and Banking Infrastructure,0.26532,0.33682352,14
BotBuilt,We use robots to build houses.,0.5746009,0.55538213,8
Simplify,Helping a billion people build their dream career,0.47034132,0.40636867,5
InpharmD,"We provide a curated, evidence- based answer to any clinical question.",0.3627078,0.6481626,16
Tilt,Bringing the joy of cycling to millions of Indians,0.4051141,0.4825651,12
Juicy Marbles,Juicy marbles makes thick juicy and marbled plant based steaks.,0.37282768,0.56013864,45
Stoke Space,"We’re on a mission, and it starts with 100% reusable rockets.",0.4857841,0.53982574,85
clicOH,Amazon-like logistics for e-commerce companies in Latam,0.33230737,0.4708014,155
Tractian,Industrial AGI,0.3631488,0.51353264,400
Codingal,Leading online after-school for kids & teens to learn AI & coding,0.5519869,0.44640037,60
QuickNode,Tools & infra to build and scale high-quality blockchain applications.,0.26485205,0.3314835,107
Resquared,Marketing automation platform for selling to local businesses.,0.42372546,0.3482306,40
Solo,We help people resolve debt.,0.30813375,0.38718757,25
Topline Pro,Generative AI powered Shopify for home service professionals,0.69047505,0.52377117,28
QuotaBook,Equity management platform for startups and investors.,0.3179145,0.36953467,50
Flextock,Tech-enabled fulfillment provider in the Middle East & Africa,0.34317935,0.46365812,10
Darrow,Bring Justice to Light,0.43279704,0.4265458,95
SST,For whatever you build.,0.42612484,0.47486663,3
Homebase,Personalized rent-to-own real estate financing using technology in SEA,0.32174087,0.396635,20
LogisticsOS,World's fastest and most optimal route optimization engine,0.4315395,0.4476369,6
LightTwist,Record video in a photorealistic virtual studio all from your browser,0.525719,0.46986493,4
Veera Health,We treat women with Polycystic Ovary Syndrome in India,0.35871577,0.6173512,4
Sendbox,Fulfillment by Amazon for African merchants,0.31844148,0.45703325,25
Text Blaze,Slash commands anywhere,0.54029244,0.3399366,9
Coderhouse,Effective and accessible online live education.,0.53976744,0.44349584,225
Enode,An API for electric vehicles and other energy hardware (DERs),0.46146727,0.5497389,40
Trela,Your one-stop shop to eat well in Brazil,0.33623227,0.48464784,120
Great Question,User research on autopilot. ,0.5455645,0.41163906,22
Datrics,Generative AI Healthcare Coding Automation,0.40206248,0.7279944,22
Aurabeat,"Providing clean, safe, virus free air for homes, buildings and cars",0.41653925,0.56355476,12
Remora,Carbon capture for vehicles,0.43975884,0.5593765,45
LiveFlow,LiveFlow empowers finance leaders with real-time insights into every…,0.3378253,0.3878975,47
Auricle,Neurostimulation implant to restore hearing & speech understanding,0.40608478,0.6311503,2
Finary.com,The new wealth manager for Europe,0.3093293,0.36669743,5
zingbus,Platform for bus travel across Indian cities,0.4061824,0.5035339,40
Greywing,The Operating System for Maritime,0.41214088,0.44263873,3
GimBooks,GimBooks makes Bookkeeping Easy for small business owners,0.33362928,0.3444111,16
R2,Embedded lending infrastructure,0.30068943,0.32855567,50
FirstSupport.ai,AI Assistant for Customer Support,0.74694633,0.51078844,4
Measured,Telemedicine platform for chronic conditions like obesity,0.39934847,0.6479924,5
BrioHR,All-in-one HR management platform for SMEs,0.45577303,0.34489036,35
Rinsed,Software to run car washes moving to a monthly subscription model,0.41903216,0.4848023,80
True3D,3D videos for all,0.5331279,0.47769392,4
Fathom,Never take notes again with the #1 AI Meeting Assistant,0.7396541,0.45990136,25
Hermes Robotics,Autonomous street sweeping as a service by retro-fitting vehicles,0.5505215,0.5424462,5
Popl,Your complete in-person marketing platform,0.42662418,0.36777702,60
Care Weather,The highest-accuracy global weather data from low-cost flat satellites,0.5060285,0.5394649,2
Pangea.app,Hire Fractional Marketing + Design Talent ,0.4534771,0.40430516,3
Kredi,Rocket Mortgage for LatAm. ,0.26191413,0.43174043,66
weweb.io,WeWeb is a no-code front-end builder that connects with any back-end.,0.453571,0.3949158,12
Logica,"Visual, collaborative financial modeling software",0.31757763,0.33089614,2
Anima,The next generation care enablement platform,0.39761275,0.66705984,20
Udhaar App,We're Khatabook / OkCredit for Pakistan,0.34925035,0.43352228,32
Mindee,AI Document Understanding API,0.6349642,0.42278776,60
Hudu,The Most-Loved IT Documentation Platform,0.5422411,0.38102794,28
Topkey,,0.0056848363,0.9062122,5
Quadrant Health,Analyzing EHR and messaging data to predict disease before it occurs.,0.38045254,0.6864088,7
Dashlabs.ai,Software for medical laboratories and clinics,0.3832168,0.66470087,30
ControlHub,Purchasing Software | Procure-to-Pay SaaS ,0.3842611,0.39952058,22
Orbillion Bio,Tasty and scalable cultivated meat at price parity,0.37384516,0.55236524,7
Kodo,Corporate card & spend management platform for Indian startups,0.30806524,0.35439914,45
Alinea,Automated investing for the next generation 💸,0.3037163,0.3481837,12
Nirva,Evidence-based Traditional and Complementary Medicine brand,0.36531922,0.6122283,10
Fintoc,Account-to-Account payments in Mexico and Chile.,0.27032727,0.3903099,60
Lendflow,Embedded lending infrastructure for software companies,0.3001866,0.32450283,55
Vapi,Voice AI for developers.,0.7237947,0.5638373,10
Parsagon,AI to track and analyze public policy,0.7066669,0.48688796,2
Aviron Interactive,"Aviron transforms workouts with game-based exercise machines, making…",0.482652,0.4816926,90
FifthTry,Continuous Documentation To End Documentation Rot,0.5753089,0.3763377,4
June,June is the new way to do product analytics,0.5544036,0.41307676,6
Per Diem,Mobile app design and publishing platform for SMB's,0.4940127,0.34067506,15
Camber,Admin automation for healthcare,0.40307596,0.71447796,70
Expent Inc,Procure the right software 5x faster,0.5410148,0.36413276,2
Bimaplan,Affordable insurance for the next billion Indians,0.3055602,0.5994215,30
Version Story,GitHub for lawyers,0.5382342,0.37656763,6
Firstbase.io,The all-in-one startup operating system,0.42525,0.4160806,50
Gridware,"Protecting the grid today, preparing the grid for tomorrow",0.46140882,0.54075086,50
Faction,Driverless electric vehicles at a fraction of the cost of a car.,0.46582508,0.55294913,25
Javelin Robotics,Copilot for truckers,0.420009,0.5288691,5
Terapify,Online therapy platform for the Spanish-speaking market,0.40891388,0.6458988,15
Noya,Radically reducing capital costs and build time for direct air capture,0.46792936,0.5389547,12
Sivo,Debt as a service for companies to lend money to their users at scale.,0.30754697,0.37341633,15
Prequel,Helping B2B co's sync data to their customers,0.5445246,0.3473387,9
Axle Health,Scheduling and workforce management SaaS for home healthcare providers,0.39915603,0.6733736,14
Valink Therapeutics,Discovering bispecific antibody drug-conjugates (BsADC) against cancer,0.3253975,0.6592951,14
Gradia Health,"Integrated, high touch healthcare — at scale",0.40319076,0.6725769,7
Cyble,Cyble is one of the fastest-growing threat intelligence provider.,0.5117776,0.43514857,260
CashBook,Ramp for Indian Businesses - UPI Wallets for Employee Expenses,0.29958674,0.37129512,4
Fractional,The place where motivated investors and entrepreneurs co-own together.,0.3401628,0.39657187,10
Encord,The data development platform for AI teams,0.6798632,0.45984918,70
Segments.ai,Build better computer vision models by building better datasets,0.6079827,0.47684878,8
Laudspeaker,Open source mobile marketing platform. Alternative to appcues /…,0.46771586,0.3451659,3
Smartcuts,Chrome extension to turn clicks & keystrokes into no-code automations,0.5461074,0.32516956,3
Axiom.ai,No-code Browser RPA,0.5418818,0.33163306,8
Weekday,Hire engineers vouched by other techies,0.4704888,0.42057815,20
Pesto,,0.007351127,0.9052218,8
Pragmatic Leaders (Ankai Inc),"AI-powered Corporate Training: Faster, Smarter, and More Effective",0.7094312,0.49877903,10
Tupelo,Marketplace for small business M&A,0.36105117,0.43384776,2
Avocado,Restaurant POS with built-in AI agent,0.7083581,0.531095,4
SpruceID,SpruceID lets users control their data across the web.,0.5050533,0.3910214,25
Flux Auto,General Autonomy for Controlled Spaces,0.5878546,0.5188343,56
Moichor,AI Powered Animal Diagnostics,0.629198,0.5008215,29
Triplit,The best database for app developers,0.52533484,0.35968384,3
Bluelight,"Analytics, built for the trades.",0.5435223,0.4125646,3
Wyndly,Life's better without allergies,0.3791731,0.5827449,10
Nourish,Telehealth dietitians covered by insurance,0.3240254,0.604679,38
GroMo,App for independent agents to sell financial products in India,0.28589994,0.35434616,100
"Gerald Technologies, Inc",Buy Now Pay Later + Cash Advance for Household Essentials,0.32735804,0.41811994,12
Curvenote,Communication and publishing tools for scientists,0.533447,0.41346666,3
Pibit.ai,Transforming Commercial P&C Industry with LLM-Powered AI,0.6954443,0.5152437,30
ModernLoop,ModernLoop helps teams automate and streamline recruiting operations,0.46803814,0.37433034,15
arnata,AI workers for the logistics industry. ,0.70640475,0.51268667,15
Pensil,"New-Age White Label Community Platform SDKs and APIs for Games,…",0.4928515,0.43997598,4
PowerRouter,PowerRouter helps sales teams with lead routing in Salesforce,0.39934483,0.37753174,3
SigNoz,Open source alternative to DataDog ,0.5846829,0.35928273,26
Spokn,AI-powered video platform for Internal Comms and HR teams ,0.711704,0.48587933,20
Hapi,Stocks and cryptos trading app with zero commissions and no minimums…,0.280239,0.34507647,45
Finley,Streamline your debt capital raise and management,0.3120399,0.35875526,32
Taloflow,"Better, faster tech vendor research",0.45224586,0.49617362,4
MedMe Health,Software for pharmacies to move beyond dispensing,0.40795386,0.37392727,30
Snazzy,Making clear aligners accessible and affordable in India,0.28749886,0.4159928,40
Howdy.com,We help US tech companies hire and manage software engineers in LATAM,0.25224403,0.44156763,300
Waypoint,"Finally, an email API with a powerful template builder.",0.4745472,0.32884106,0
Lion Pose,"Clinical skincare tested on diverse skin, now available in Sephora.",0.37180454,0.5534396,3
Lygg,Creating New Anti-Aging Ingredients,0.3694102,0.5788926,1
Albedo,Capturing the highest resolution satellite imagery,0.49977568,0.5384561,55
authzed,Cloud Infrastructure for Authorization,0.60859007,0.32811463,31
DreamWorld,DreamWorld is a next-gen Minecraft with generative AI building,0.66226584,0.4464203,20
Humaans,AI-Powered HRIS for high performing teams,0.71049726,0.48804045,43
Alba Orbital,"We make satellites to image everywhere on Earth, every 15 minutes",0.5034674,0.5376924,16
Trestle Biotherapeutics,Bioengineered kidneys for patients with kidney failure,0.34435505,0.64163923,2
The Third Place,Subscriptions for neighborhood businesses ,0.40925872,0.43565536,2
Gaiia,all-in-one operating system (OS) for telcos,0.4259061,0.42072174,40
Atomic Industries,The world's first AI powered tool and die maker,0.6171845,0.5152858,25
cloud humans,AI-powered customer service for startups,0.7419595,0.5173359,30
Atrato,Enabling consumers split the cost of purchases without a credit card,0.31128743,0.38518658,80
Bristle,"At-home oral health testing, coaching & care",0.38518512,0.6382486,6
Serna Bio,Genetic Medicine with Small Molecules ,0.32210773,0.66773814,9
Abacum,Helping Finance teams be 10x faster,0.3906088,0.37888893,110
Lovd,"It's not used, it's Lovd.",0.42669323,0.47750834,4
Runway,Easier and more reliable mobile app releases for teams.,0.48069927,0.36643162,18
eqtble,Turning HR data into actionable insights,0.51332766,0.3898962,5
Journey,No code platform for sales to tell better stories and win more deals.,0.40844885,0.40337938,10
Webiny,Open-source framework for building serverless applications,0.55208844,0.32191372,6
PipeBio,PipeBio is a SaaS bioinformatics platform to develop antibody drugs.,0.33634192,0.64738375,10
Friz,AI Social Media Manager,0.72101986,0.4783375,4
inBalance,"Electricity price forecasts for energy storage, ev charging, etc.",0.45107347,0.54745793,10
Awari,Reinventing lifelong learning for the future of work.,0.5072174,0.4129131,35
Uiflow,No-code platform for enterprise software companies,0.5324366,0.32021654,21
Kitemaker,A faster and more collaborative alternative to Jira for remote teams,0.50159967,0.37031475,5
unSurvey,"AI-led market research interviews, no scheduling, instant insights.",0.71086776,0.49745184,8
Preki,Shopify for LatAm,0.25526053,0.45899945,15
Worksphere,Manage your hybrid workplace,0.4591668,0.38053814,6
Pyroscope,Open source continuous profiling software to debug performance issues,0.5730921,0.33798215,5
Dyte,"Real-time audio & video SDKs, ready to launch 🚀",0.50769985,0.45731413,45
Enable Us,Digital Sales Rooms (Acquired by MindTickle),0.38651225,0.4281271,14
Partnered,The network where sales teams connect to share customer introductions.,0.4089391,0.37123874,2
TechBiz,MIS on mobile for SMB's in India,0.35377643,0.41604382,3
Verak,Better Business Insurance for MSMEs in India,0.2969295,0.5972615,45
Trendpop,Discover trends as they happen,0.5515587,0.4210161,10
Roin Technologies,Building robots to automate commercial concrete construction.,0.5863501,0.5357143,3
Procoto,Self-service RFP management,0.55297554,0.33804098,4
Promoted.ai,Dramatically better search and ads for marketplaces,0.43809986,0.37289846,12
Emerge Tools,Supercharge your mobile apps,0.48966962,0.37057114,9
Pry Financials,Finance for Founders,0.32889375,0.33977604,7
OctiFi,Buy Now Pay Later for Southeast Asia,0.32388455,0.41707155,11
Bueno Finance,Building Chime for India,0.33231503,0.43162203,18
FunctionUp (FanPlay),A skill-tech platform that runs placement bootcamps,0.5364495,0.38567176,20
HyperGlue,Business intelligence on text,0.5645027,0.3962255,5
Flok,End to end company retreat planning,0.39042524,0.39031947,5
Avenue,Observability platform for operations teams,0.5964737,0.34390768,8
Fountain9,Helping food brands and retailers reduce food wastage,0.3560431,0.49455005,8
ClipDrop,Turn regular mobile photos into professional product visuals,0.4983782,0.45320895,5
Furmacy,Digital e-prescribing software for veterinarians.,0.39722097,0.6607784,5
PingPong,Video messaging app for remote teams.,0.49488106,0.40934858,8
Stacksi,Automated Answers to Security Questionnaires,0.6213431,0.37058678,4
Alltruists,"Kid-friendly, at-home volunteer projects in a box, delivered bimonthly",0.4490932,0.45762354,1
MeetAnyway,We help run engaging online conferences.,0.47457957,0.42207792,3
Outfit,"DIY renovations in a box. Materials, tools, and instructions delivered",0.43286008,0.4711528,1
boitas.com,Largest B2B eCommerce platform for SMBs in Latin America. ,0.3815471,0.41170046,35
Blink,Same-day delivery for e-commerce companies in Europe.,0.34742695,0.47143316,5
Galaxy,Social SDK for games,0.49209702,0.4340451,2
Cheqout,Mobile ordering & payments for Brick & Mortars,0.3456534,0.41382286,6
Mezli,"Autonomous restaurants that make great, affordable meals.",0.35391974,0.49790138,8
Dressd,Make infinite $$$ off of clothes in your closet without selling them,0.40217605,0.45555004,1
Moonshot Brands,Buy and grow profitable e-commerce companies selling on Amazon and DTC,0.3742398,0.4157699,35
Dataherald,Embed NL-to-SQL into your Product 📈,0.56186205,0.39360383,18
Prendea,Live afterschool classes for Spanish-speaking kids ages 4 to 15.,0.5312035,0.45422012,5
Eat Blueprint,Longevity Nutrition Service,0.3668355,0.6095118,2
Codeball,AI-Powered Code Review,0.67094195,0.44007456,3
Fable,The command center for product teams,0.5190994,0.361964,2
Entelexo Biotherapeutics,Creating a New Class of Drugs to Address Incurable Autoimmune Diseases,0.32647106,0.65509415,3
HomeBreeze,The fastest and easiest way to make home upgrades,0.42157418,0.45840016,40
Aerotime,Calendar that kills time fragmentation,0.51627725,0.39753038,6
Launcher Labs,"Maker of consumer crypto apps: Launchcaster, Frameboard, Maindrop",0.2603822,0.33592263,4
Finantier,Plaid for Southeast Asia,0.32578042,0.42893332,40
Taste,Online marketplace for dinners shipped from great restaurants,0.3478554,0.48038232,2
Platypus,The Distributed Data Operating System,0.59065807,0.3546554,3
Noble,Risk decisioning platform ,0.780578,0.46206626,12
Nimbus,Nimbus reduces Datadog costs by more than 60% without Manual Effort,0.5881514,0.35970032,3
Milk Video,Create video testimonials with a link,0.5167681,0.45673963,2
MarcoPolo,Alibaba for Latin America,0.30504858,0.43453464,0
Purpose Finance,Accelerating the shift to a more transparent economy ,0.3393155,0.34525517,3
Invoid,Create identity verification workflows the way you want,0.6252821,0.33871007,15
Lalabox,Live stream shopping for beauty products,0.4102194,0.47069675,4
Huddlefire,Turbocharge customer acquisition through exclusive SaaS partnerships,0.4066854,0.345625,2
YourQuote,YourQuote is India's largest writing platform,0.46343884,0.39882463,9
Charge Running,"Provides live, virtual running classes to runners all around the world",0.48580742,0.4175968,3
BeWell Digital,Building the operating system for diagnosis.,0.39134935,0.6741179,2
noHQ,International contractor and multi country payroll ,0.33471426,0.38229758,2
Clay,Figma for 3D design,0.523742,0.4946662,5
Finary,Discord for investing.,0.31310713,0.38369045,6
GoBuild (fka Brick),The payments solution for small scale construction. ,0.3506061,0.3708113,18
Mythia,Rewards card for gamers,0.33209124,0.38222098,0
JoinSub,India's first aggregator and provider of local business subscriptions,0.3653223,0.41068846,8
Krab,Instant loans for trucking companies in India,0.29448825,0.3965977,9
CoVerified,Using infection data to keep organizations safe,0.59556925,0.3519255,9
Queenly,Leading marketplace for formalwear,0.38581103,0.4557453,13
SlashAuth,The solution for fine-grained access control in web3,0.6187554,0.33455816,3
Observa,Catch accidental database exposures before the bad guys,0.59012383,0.3480974,1
Gigs Live,Video publishing and monetization platform for creators and artists,0.4738157,0.44030398,3
Unfurl,A virtual food hall that delivers,0.35518596,0.4667502,20
SBX Robotics,Synthetic data for better vision.,0.6010794,0.47923225,5
Neverland,The first online home garden and lawn marketplace ,0.39170474,0.42434767,2
Playmaker,Community for fantasy sports players,0.46158105,0.4222691,5
Quadrant Eye,Breaking new ground in online eyecare. ,0.40558487,0.6482167,4
Degrees of Freedom,"DoF provides a high quality, affordable higher education alternative.",0.52538466,0.4483807,7
Gonddo,Wholesale marketplace for independent retailers buy & manage inventory,0.36263445,0.44304046,6
Gilgamesh Pharmaceuticals,"Gilgamesh Pharmaceuticals, a Clinical stage biotechnology company…",0.34992313,0.627883,15
Payflow,"AI FP&A Agent for insights, reports, planning and forecasting.",0.71791506,0.48822367,7
Matter,Building the future of reading,0.5396902,0.43367,7
Verifiable,API for healthcare compliance ,0.37476858,0.66809285,12
Rarebird,Elevating mental health to be a part of your daily coffee ritual.,0.39973533,0.5927585,5
Future Fields,We make unmakeable proteins with radical advanced biomanufacturing. ,0.36967,0.58913165,34
SiPhox Health,Wearable and At-Home protein monitoring with silicon photonic chips,0.38013053,0.64733815,30
Clau,The real estate superapp for Mexico,0.3267384,0.40932906,90
Todos Comemos,Taking from 1 to 100 the premade food industry in LATAM,0.26566178,0.45620307,62
Hubla,All-in-one platform for creators to sell courses and subscriptions,0.45821556,0.43423,86
Fieldguide,Vertical AI for Audit & Advisory Firms,0.7575942,0.49868402,130
Parrot Software 🦜,The operating system for restaurants in LatAm.,0.28118855,0.4602218,40
Zuddl,Zuddl is a modular platform for events and webinars that helps event…,0.4878447,0.41414136,120
Mozart Data,The easiest way to set up a modern data stack,0.5724437,0.37114245,24
Inspectify,"Home Inspections, Simplified",0.38320825,0.44676235,55
"Warmly,",Autonomous sales platform to auto-email your warmest leads,0.442087,0.3287142,75
Rally,Rally is Zoom for social events,0.45993304,0.42598754,3
Glimpse,Glimpse offers AI services for retail brands starting with deductions ,0.70715505,0.52854156,3
Mobius Materials,The spot market for semiconductors,0.46760327,0.49557215,6
inSoma Bio,Helping Plastic Surgeons Rebuild Fat,0.36441165,0.6302767,4
Pardes Biosciences,We break viruses,0.35051012,0.61757964,2
"MedPiper Technologies, Inc",Salesforce for health data,0.36943722,0.6777513,37
Vena Vitals,A small sticker that monitors blood pressure continuously,0.38142174,0.62977755,9
Afriex,"Instant, low-fee remittances",0.28742626,0.38905975,55
Dumps,Where friends connect through photos and chaotic messaging,0.49445242,0.43407226,9
Lendtable,We give employees cash advances for their 401k match and ESPP,0.31110942,0.39101762,20
Spenmo,"A spend management software that provides businesses visibility,…",0.35686693,0.33605817,200
Mito,Cursor for data analysis,0.9996616,0.34301105,3
DraftWise,Contract and negotiation AI built for lawyers,0.75259817,0.48123732,50
Finch,Finch is the universal API for payroll and HR,0.42185855,0.35676464,63
Heron Data,We automate document-heavy workflows in financial services and beyond,0.61040163,0.3980078,26
Ready,Collaborative platform for optimizing regulated utilities such as…,0.45241702,0.5260277,70
Supabase,Build in a weekend. Scale to millions.,0.42872608,0.4603958,120
SockSoho,Building world's largest men fashion brand powered by technology,0.39295042,0.48535657,22
CarbonChain,We help companies automate the accounting of their carbon emissions,0.43971208,0.5602957,16
Arketa,Everything for your fitness or wellness business.,0.36870176,0.5064087,55
HENRY,We train the best software engineers & data scientists in LatAm  ,0.2543278,0.44275397,100
Laylo,The Drop CRM,0.46774873,0.3275341,12
Taktile,Empowering decision makers to make smarter and safer decisions at…,0.51920384,0.47369605,150
Formal,Take control of your data in real-time.,0.5574653,0.36937672,10
Akiflow,All your tasks and calendars into an AI-powered productivity app,0.69470394,0.45752996,18
Dataland,AI agents for customer support.,0.7436344,0.5078017,2
PANADATA,We run background checks on businesses using data from public records…,0.4351244,0.38643426,4
Awtomic,Dollar Shave Club as a platform. ,0.33937222,0.38991532,11
Farel,Next-gen airline OS,0.425619,0.42569864,9
Hotplate,Online ordering platform for independent chefs and bakers.,0.3488912,0.4731049,11
Minimum,Helping corporates achieve Net Zero through tech solutions. ,0.43941587,0.41900176,0
Skio,Subscriptions for Shopify,0.38810742,0.4237468,60
TyltGO,TyltGO powers retailers with same-day delivery.,0.3397468,0.4751261,15
Scrimba,We turn people into hireable devs for 1% of the price of code…,0.48099154,0.4154391,6
Nephrogen,Curative gene therapies for kidney diseases,0.32021976,0.66621155,1
Flint,Securing Nurses for Your Future,0.3931741,0.6136443,20
Liyfe,Digital Nurse to Automate Symptom Assessment and Risk…,0.40691525,0.6905364,2
Tella,The screen recorder that edits videos for you.,0.51607317,0.4661235,6
Kingdom Supercultures,Natural functional ingredients that actually work,0.36962464,0.5698402,18
