name,tagline,pos_x,pos_y,team_size
SafetyWing,Health insurance for remote teams,0.30790597,0.5986109,130
Gainful,Personalized Performance Nutrition,0.36446095,0.63791597,30
Volley,"Voice AI games on smart speakers, TVs, and mobile",0.71940666,0.56603295,80
Cognition IP,Flat-fee patent & trademark counsel with top firm results,0.44011164,0.39117628,12
Substack,A place for independent writing.,0.50507635,0.41106838,90
Players' Lounge,Win money betting on yourself playing AAA video games,0.36423224,0.3945597,13
Treasury Prime,Embedded banking software platform and marketplace,0.29253748,0.32820258,100
Universe,Design and build any kind of website. On your iPhone or iPad.,0.49070576,0.37691534,25
Juni,A learning platform helping every student achieve their best future. ,0.54513055,0.43605405,30
Psylaris,Psychotherapy through autonomous and personalized VR-sessions.,0.41003978,0.64520764,10
Let's Do This,The online company that gets everyone offline,0.46744904,0.38907087,75
Podcast App,Podcast App is for the curious.,0.48790935,0.43279067,18
Supermedium,VR space of immersive utilities,0.5043153,0.48668167,2
Tributi,Tax filing automation for individuals in Latam.,0.353504,0.3543591,20
Sourcify,Sourcify helps brands manufacture products in Asia.,0.36679095,0.5177646,15
Plexus,High-performance gloves for VR and AR,0.49063084,0.49647075,3
tEQuitable,tEQuitable's mission is to create work culture that works for everyone,0.4678754,0.40068972,6
EnvKey,End-to-end encrypted configuration and secrets management,0.61575645,0.33849874,2
Meitre,Opentable for the world's top restaurants; we help them increase…,0.35051033,0.48773316,9
BioRender,'Figma/Canva for scientists’,0.4960759,0.49405658,205
LUS Brands,Hair care products for curly hair. ,0.37152576,0.5575841,20
Draftbit,Build mobile apps visually. Source-code included. ,0.51281685,0.33970055,10
Nuvocargo,Radically simplifying cross-border logistics between USA & Mexico,0.3343016,0.47684833,150
Dear Brightly,"Dear Brightly makes personalized prescription skincare products,…",0.37532726,0.5404146,3
Vanta,Vanta—the proven leader in automated compliance helping startups…,0.58298385,0.4469698,700
Persephone Biosciences,We are using the gut microbiome to end cancer. ,0.34874833,0.6202495,6
AesculaTech,"Responsive materials, better lives. ",0.43635997,0.52559334,6
Promise,Better payment systems for governments and the communities they serve.,0.30009055,0.38882783,80
Tradewind BioScience,Tradewind translates scientific insight into innovative ways of…,0.44156134,0.4885556,2
Modern Health,A mental health benefits platform for employers.,0.41265872,0.64033467,375
Biobot Analytics,Population health analytics powered by wastewater.,0.3797579,0.65191704,12
NEXGENT,,0.0,0.9084497,25
Nectome,Building a way to preserve long-term memories.,0.46300465,0.4741717,5
Avro Life Science,Skin patches for generic drug delivery. ,0.3670166,0.5916883,8
Macromoltek,Computational antibody design,0.3255949,0.6841443,14
SRTX,Powering a better future for textiles.,0.42091152,0.5490503,150
Simetrik,No code enterprise SaaS for financial control automation.,0.312771,0.3423219,350
Key Values,Helping software developers find teams that share their values. ,0.51772076,0.35908034,1
CoinTracker,The gold standard in cryptocurrency portfolio tracking and taxes,0.26471138,0.3314855,70
Glowing.io,"Unified, enterprise messaging platform for leading brands of the world",0.4465672,0.3819296,11
Sixfold Bioscience,Delivering RNA therapies.,0.3114009,0.6769927,27
Slite,Team documentation removing the pain of maintaining and finding info,0.5540473,0.38118565,40
Worklytics,Analytics to improve how teams work and collaborate,0.5332006,0.38035348,0
Fondo,"Bookkeeping, tax, & tax credits on autopilot for 1,000+ startups",0.337819,0.34051737,53
Observant AI,iPhone-based driver monitoring for commercial fleets.,0.41725752,0.5074376,5
Jasper.ai,Jasper is a leader in creating content using Artificial Intelligence,0.6443424,0.44953817,195
Shogun,Shogun empowers brands to create exceptional ecommerce experience.,0.37935585,0.4533916,90
Blueberry Pediatrics,24/7 pediatric clinic in every family's living room,0.3867298,0.6397811,15
Spellbrush,Making Anime Real,0.5114665,0.467156,28
Torch,,0.006710897,0.9032252,130
Precious,AI to curate your baby photos,0.6235043,0.4731761,7
Quantstamp,Security auditing for Web3,0.61638963,0.34021324,80
Proven Group,"PROVEN is using AI, data and personalization to disrupt CPG",0.56967604,0.38523647,40
"Lucy Goods, Inc",Lucy’s mission is to reduce tobacco-related harm to zero. We provide…,0.36590615,0.5981547,7
Look After My Bills,"Personal fintech - we optimise your bills, every year, automatically.",0.32482713,0.344687,2
Qulture.Rocks,"The people, management, and culture operating system for your startup.",0.4397448,0.39794773,70
Mighty Buildings,"3D printing beautiful, high-quality, and sustainable homes.",0.43588537,0.49530703,200
Zyper,Recreating social networks for brands. ,0.42868087,0.38189605,35
Swipehouse,Meet other creators. Get daily matches. Find brand deals.,0.4248834,0.42929697,5
Medumo,We manage patient instructions for hospitals,0.3906732,0.6528895,12
YouTeam,We make it easy for startups to hire engineers.,0.45441866,0.42536646,34
Mojo,Mobile app for creating pro-quality social media videos,0.49951556,0.44663876,20
Dataform,"Manage data in Snowflake, BigQuery, and Redshift",0.5839892,0.37173408,10
Copilot,Shopify for Professional Services Businesses ,0.37420306,0.40547574,15
SharpestMinds,Peer-to-peer mentorships through income-share agreements.,0.3475674,0.3612031,4
Naborly,A credit bureau for the renting generation.,0.31541014,0.42130023,25
Edwin,Edwin is virtual English tutor - an AI-powered service for learning…,0.6533434,0.48753595,14
Lawyaw,Automating document-based workflows,0.6126619,0.39133558,15
Evry Health,Better health insurance for mid-size companies,0.30407995,0.5982749,40
Flinto,Mexico's digital wallet,0.26239502,0.37998787,0
Beanstalk,"Great tasting produce, farmed around the corner",0.366268,0.5360472,15
NewCraft,Universal API for HR & Payroll,0.40975857,0.3486751,2
Jido Maps,Turn your data into a deployed computer vision model,0.60046417,0.48061973,6
CodeStream,CodeStream is a Developer Collaboration Platform designed to…,0.5168613,0.40491813,10
Sepsis Scout,Wearables and AI to predict and prevent sepsis outside the hospital,0.39828914,0.7014128,5
Glimpse K12,Glimpse eliminates ineffective spending in schools.,0.53754824,0.4565461,6
ClearBrain,Causal Analytics for Growth Teams,0.5259461,0.39203948,10
Pulse,We're crowdsourced Gartner so IT executives can learn directly from…,0.5101373,0.41771287,11
Memora Health,Digitize and Automate Complex Care Workflows,0.40025166,0.6960241,115
onederful,Dental Insurance API,0.35246882,0.6534879,2
Hunter2,Hunter2 trains engineering teams in application security through…,0.5387276,0.50950766,0
Mayhem,Mayhem is the easiest way to play with your gaming community.,0.46957976,0.45429933,10
Point API,Point stores things you send over and over again and helps you re-use…,0.41003188,0.43360168,5
Hexel,Create a cryptocurrency for your community.,0.2600879,0.35380244,2
Ben,"The easiest way to learn about, buy, and store cryptocurrency.",0.2583058,0.34372634,2
Secured,"Tools for Sneaker, NFT & web3 investors",0.36956885,0.3881675,12
Voicery,Automated voice acting and emotive speech synthesis with deep neural…,0.7069131,0.56106097,2
Squad,Squad is an app for live communities to have shared experiences…,0.4630309,0.41571087,10
Iambiq Technologies,,0.007082491,0.90511477,2
Atrium,Modern law firm for startups powered by proprietary technology,0.43165913,0.3762938,180
Pagedraw,Pagedraw is a platform for productionizing designs into code.  Thanks…,0.50929064,0.39700478,5
Shone,Shone makes existing cargo ships autonomous through retrofit.,0.48343372,0.54898214,8
Vathys,Accelerating machine learning through software,0.6162719,0.44197354,6
OSIMple,Software for inspectors to automate their paper workflow. ,0.6075103,0.39926025,2
Haiku,Collaboration tools for software companies,0.5111871,0.36029455,0
miru,Experience any piece of furniture in AR,0.38256958,0.46304977,1
Station,Your team’s automated knowledge base,0.54290104,0.38974157,9
Nutrigene,Personalized liquid supplements based your health data,0.35848793,0.64833176,0
Storyline,Create Alexa Skills without coding,0.5293587,0.3349279,3
Meson,Meson is a stablecoin swap protocol among blockchains and Layer 2s,0.25931716,0.3360212,10
Viaopt,Uber pool for corporate trucking fleets,0.37039554,0.4892756,2
Openland,Messenger for communities,0.48226783,0.4060867,14
Correlia Biosystems,Next-gen blood testing to provide 1000x more data to pharma companies,0.35472533,0.6569984,16
Aalo,Lego-like furniture for design geeks. We create furniture that's…,0.43685165,0.47910404,1
Curious Fictions,Patreon for professional authors.,0.4646057,0.43500444,2
Tingles,Find content that helps you relax and fall asleep.,0.44791067,0.4673109,6
Reverie Labs," Engineering next-generation, brain-penetrant cancer therapies.",0.33065012,0.6648375,29
OurMenu,,0.003724404,0.9077381,3
Skip,Electric scooters for reliable last-mile transportation.,0.47600302,0.5566081,2
Closer Sports,Mobile streaming platform connecting professional athletes with their…,0.47885978,0.4226201,2
Rhythmm,Read interesting conversations,0.48588884,0.4550255,2
Tipe,"Open-source, customizable, headless CMS",0.5329458,0.33099872,5
Necto,ISP starter kit,0.46065298,0.4207474,4
Ovipost,Automated insect farming,0.5699975,0.5538275,20
Sketchbox,Wordpress for AR & VR,0.49526796,0.4752078,20
California Dreamin,Cannabis infused beverages,0.37014788,0.5289116,2
Cashfree Payments,Next-gen digital payments provider for India.,0.2885972,0.39138648,200
Modern Fertility,At-home fertility test for women who aren't ready for kids right now…,0.35734218,0.63531595,25
Flock Safety,The first public safety operating system that eliminates crime.,0.5902096,0.33785695,1000
Candidate.ly,The digital storefront for staffing and recruiting teams.,0.44222236,0.38812077,9
Thematic,We analyze feedback to help companies improve customer experience,0.43488052,0.36983886,25
10 By 10,10by10 is a unique marketplace in the recruiting agency industry for…,0.46659508,0.4178559,5
Forever Labs,"We bank your stem cells to help you live healthier, longer.",0.3586802,0.6163078,12
FollowUpThen,FollowUpThen is an email-based personal assistant that sends you…,0.475323,0.33322257,1
Gem,Talent engagement platform,0.47786823,0.38252163,200
Just Appraised,Just Appraised makes software for local governments.,0.3910755,0.4040239,40
Routable,Simplifying payouts at scale,0.3498857,0.3505461,160
Zendar,We make high definition radar allowing self-driving cars to see in…,0.50961435,0.5356132,45
May Mobility,Transforming cities and rural areas through AV transit and technology,0.41555718,0.49947247,260
Officely,Building next generation tools for the hybrid workplace,0.4782092,0.36086938,11
OneLocal,OneLocal is a CRM for local businesses.,0.39290035,0.40475416,90
Muzz,Where Single Muslims meet,0.45494407,0.44458163,104
Sourceress,,0.015972655,0.90015733,35
Oncobox,Finding the right cancer drug for each patient. ,0.34094387,0.6535279,11
D-ID,Enable creators and developers to generate realistic AI personas,0.6806872,0.460476,27
Tesseract,Tesseract builds better thrusters for modern satellites,0.5117465,0.5406899,6
Skyscrape,Skyscrape makes temperature-responsive insulation,0.45319402,0.5057494,3
tpaga,First financial Superapp of Latin America,0.2845363,0.39226148,25
Flowspace,The operating system powering ecommerce fulfillment,0.3757981,0.4409366,48
Airthium,Decarbonized heat and power cheaper than fossil fuels,0.44153595,0.5512939,12
Rev Genomics,Rev is a biotechnology company creating better plants.,0.36208734,0.5806809,8
Pyka,Autonomous electric airplanes,0.5399407,0.55044943,75
Entocycle,Automated factory to produce insect protein for farm animals. ,0.562633,0.5608052,13
HelpWear,,0.02095292,0.8982286,2
Spect,Value-based retinal screening in primary care to prevent blindness. ,0.3822909,0.6451959,7
Rabbet,"Bringing efficiency, accuracy and transparency to construction finance",0.33635148,0.35236335,23
Upfort,Turnkey security & hassle-free cyber insurance from leading insurers,0.2948361,0.6005469,38
Pop Meals,Pop Meals is a restaurant chain without chefs. All recipes are…,0.36831176,0.51851267,153
Goodcover,"Digital Co-op Renters Insurance = half the price, better coverage.",0.30388555,0.5972475,4
Cairns Health,Your voice. Your health. We care.,0.37967783,0.6240355,17
Prelim,Software for banks to open bank accounts,0.3147106,0.33237633,36
Advano,Advano is a battery technology company that improve the longevity of…,0.43198404,0.5314998,25
Carrot Fertility,Customized fertility benefits for modern companies. ,0.35441497,0.6212266,0
AssemblyAI,APIs for AI models,0.6667104,0.44958928,65
Relationship Hero,Dating & relationship coaching sessions for individuals and couples,0.46893364,0.45530394,100
CocuSocial,Marketplace for local activities.,0.3810499,0.44606254,10
Darmiyan,Early detection of Alzheimer's disease,0.375549,0.657097,8
Bloom Institute of Technology,The online coding school that invests in you.,0.54036057,0.44702032,50
Aecore,Vertically integrated commercial construction,0.42850024,0.48840204,6
ThereCraft,,0.02014157,0.8986753,1
Releaf Earth,Turning food waste into Biochar to remove CO2 from the atmsophere,0.40819135,0.5640154,100
VergeSense,AI-Powered Building Management,0.67853874,0.5102254,70
Leon & George,Buying and owning indoor potted plants made easy.,0.3681336,0.47113314,10
Nobell Foods,Cheese and dairy products from plant-derived dairy proteins,0.36984423,0.5620522,58
Jerry,Jerry makes it really easy to save time and money on car expenses. ,0.38896388,0.5008619,288
Long Term Stock Exchange,LTSE is an ecosystem for visionary business.,0.43198755,0.41141754,68
BillionToOne,The genetic testing platform detecting and measuring disease.,0.36054328,0.67437744,300
Nimble,Data-driven teacher hiring,0.5284118,0.39059553,25
SafeButler,Your chief servant for shopping insurance,0.29512438,0.5868542,2
VIDA & Co.,Platform for unique products produced on-demand at mass-scale,0.45090914,0.4322043,11
Dharma Labs,The easiest way to buy 74k+ crypto tokens with USD,0.26881045,0.35630625,14
PullRequest,Code review as a service - combining automation with a network of…,0.5942536,0.37278542,11
Roofr,Sales software for roofers. Aerial measurements + proposals in seconds,0.38332206,0.3996039,40
Opearlo,Opearlo produces voice apps for Amazon Alexa and Google Home.,0.46026886,0.44421145,2
Eduflow,Create and run collaborative online learning experiences.,0.529157,0.43814626,12
Headstart,Headstart uses Machine Learning to help companies decide on who to…,0.56626856,0.43251687,44
Standard AI,AI-powered checkout for retail.,0.69870156,0.5368019,150
UpCodes,UpCodes helps the AEC industry deliver code compliant buildings,0.4122582,0.44781983,23
Helium Health,Africa's #1 healthcare technology provider.,0.34014383,0.60922045,110
FAZZ,All-in-one Finance for Every Southeast Asia Business,0.31268698,0.35822985,500
Skyways,Creating a new form of air transportation.,0.49778396,0.5518847,23
disclosures.io,The Complete Listing Toolkit for the New Era of Real Estate,0.33835799,0.40700495,10
Surematics,We help commercial insurance brokers structure complicated…,0.2974502,0.59968704,2
bxblue,bxblue is a marketplace for people with guaranteed income in Brazil.…,0.3494022,0.41997302,28
Indivio,Customize videos to be more relevant and improve business outcomes.,0.5006698,0.46262228,8
Percept.AI,AI support agent for your business that actually works,0.7427766,0.49356648,7
Guilded,Chat for gaming communities,0.49275413,0.44324768,30
Honeydue,"The simplest way for couples to manage money, together",0.30723584,0.3589095,2
LotusPay,Recurring payments solution for businesses in India.,0.29010382,0.38742524,5
Truepill,API-connected healthcare infrastructure.,0.38540092,0.6751645,1300
Plasticity,Natural language processing APIs for developers.,0.58933026,0.42928287,2
Wildfire,Social news app,0.4799966,0.41097435,3
Meetingbird,Automated meeting scheduling for teams,0.7272787,0.4687262,2
Solve,"We save travelers hours by meeting them at their arrival gate,…",0.39706445,0.47205406,2
Mystery.org,We help kids stay curious by creating better explanations.,0.54303014,0.44319066,53
Enzyme,Automating regulatory approval & compliance for life science companies,0.35894734,0.6943141,32
Templarbit,Protecting applications from malicious activity,0.60710883,0.3338168,11
Escher Reality,The backend for Augmented Reality.,0.50806975,0.48987424,2
Fat Llama,Fat Llama is the first fully insured peer-to-peer rental marketplace.…,0.3719141,0.4880588,41
Ribbon Health,"Health enterprise API for data on doctors, insurance, costs, & quality",0.3672611,0.6637851,91
CarDash,Managed marketplace for automotive services. ,0.38688442,0.48368642,12
Feather,Furniture rental for consumers and businesses.,0.37765098,0.4566757,125
AutoHub,We help dealerships appraise vehicle trade-ins more efficiently…,0.36854437,0.47927496,2
Audm,Audm is a subscription service providing mini-audiobooks —…,0.473476,0.43895444,10
WheelStreet,WheelStreet is a Motorbike rental marketplace that connects…,0.38527286,0.48285744,10
Py,Py is democratizing access to career opportunities in tech,0.49483606,0.4051543,3
Elucd,Polling through mobile ads to enable governments to make better…,0.45136383,0.40262833,8
NextDrop,NextDrop is the water marketplace for urban India.  We connect water…,0.39944243,0.49869904,11
Bumpline,Captain Tailor is the Uber for tailoring. ,0.39634573,0.49380493,2
Cambridge Cancer Genomics,CCG.ai empowers clinicians to make personalised treatment strategies…,0.38786042,0.7100032,25
Gamelynx,Easily watchable cross-platform competitive games.,0.49718705,0.44560683,5
Guggy,"Guggy is building the messaging app of the future with real time,…",0.48678023,0.4142567,2
Sunu,Audio and Haptics AR interface equipping blind users with super powers,0.51000476,0.49376157,11
And Comfort,And Comfort is a direct to consumer fashion brand.,0.3908933,0.48464406,2
PreDxion Bio,"Rapid, scalable diagnostic for SARS-CoV-2 and beyond",0.36234927,0.6726167,6
Goosebump,Find the best electronic music events in a single message.,0.4921065,0.4509744,2
Modular Science,We're making it easier to do sustainable farming.,0.38624918,0.56254,0
Piggy,"App for Indians to make investments in mutual funds, manage their…",0.2958671,0.35046977,2
Slik,Slik enables the long tail to use email outreach. ,0.47128117,0.33253425,2
Storyboard,Social media management tool for Instagram and Snapchat,0.45529836,0.3943436,2
RideAlong,We save lives by giving police and health workers key info to safely…,0.38904285,0.579703,2
Lyrebird,Our tech speaks for itself.,0.4467504,0.48795557,13
Social Construct,Social Construct designs and assembles large apartment buildings …,0.4287262,0.4861855,17
Polly,Polly is a social polling app for Snapchat and Instagram stories. ,0.45964158,0.415021,3
Commissary Club (formerly 70 Million Jobs),Social network for 70 million Americans with criminal records.,0.46091697,0.40100855,8
Caelum Health,Caelum Health is replacing drugs with software. We use behavioral…,0.3603943,0.6279601,2
Covetly,"#1 Collectibles Marketplace: Authentic Vinyl Toys, Comics, Funko Pop ",0.38304886,0.44216868,3
Semantix,AI for medical billing,0.4045692,0.73988825,2
WATERFX,The world's first 100% sustainable water provider (aka alternative…,0.40926433,0.52801025,1
Value Voting,Platform to defeat political extremism through strategic primary…,0.4383924,0.40733996,2
Gameday,Play fantasy sports with friends on Facebook Messenger,0.4898891,0.42726302,2
Sixty,On demand web app help,0.49341464,0.3517388,4
Dropleaf,Subscription service for all you can play indie PC games. ,0.4704275,0.44726306,2
Pathrise,YC for your career,0.48129287,0.41544074,55
Prism Labs,,0.011416782,0.9032092,5
Sunfolding,Sunfolding builds next generation infrastructure for solar farms.  By…,0.41907787,0.5242316,44
Passerine Aircraft,Passerine Aircraft is building the next generation of dronesWe are…,0.50447625,0.54724,2
Brex,"Business accounts, corporate cards, and spend management software.",0.3037549,0.36558414,1000
Clipboard Health,Connects healthcare facilities with nurses nearby.,0.38370454,0.6356169,600
Faire,The global online platform empowering independent retail.,0.3693732,0.42850748,900
Rippling,"One place to run all your HR, IT, and Finance. Globally.",0.32638088,0.36269492,2500
Fastpad,Hiring Software for India,0.36337066,0.3900525,3
ACLU,Defender of rights and liberties,0.41833553,0.40755543,501
Mystro,Mystro is an app that makes rideshare drivers up to 30% more money by…,0.40071094,0.4728824,6
Greo,Greo is a mobile video app for conversations about current events. ,0.485894,0.42047426,2
Retool,Build internal tools fast.,0.50510764,0.38504714,300
Dost Education,Getting kids ready for school in India.,0.52197033,0.44016898,30
Helix Nanotechnologies,"Next-generation mRNA platform to solve cancer, COVID and climate.",0.31549546,0.6699765,22
Mirror AI,App that turns selfie photos into thousand emoji that look like you…,0.49451888,0.45721155,7
"Lively, Inc.",Modern employee benefits & health savings account (HSA) provider,0.3112271,0.60050684,195
The Centre for Effective Altruism,We're your non-profit portfolio managers. We make giving to…,0.33206865,0.3789871,15
Fam,Video calling social network to talk with friends and make new friends,0.51386935,0.44448268,11
UpKeep,Mobile-first software for maintenance teams.,0.4871146,0.3509395,150
"Wifi Dabba, Inc.",Decentralised broadband connectivity.,0.44355205,0.4452153,21
OneFin,Shopify for Financial Services,0.35689285,0.37475643,50
Delee,Blood testing device for early diagnosis of cancer and treatment…,0.363043,0.65002847,18
BIOS Health,Neural interfaces to understand and use nerve data in medicine.,0.40863734,0.6509034,45
NanoNets,Automatic Data Extraction,0.6179521,0.4061618,102
AON3D,Additive Manufacturing with advanced materials,0.48669815,0.5083163,40
Sigma Genetics,Sigma Genetics is a biotechnology company that is building…,0.34353438,0.6294671,2
BuyPower,Modern bill payment platform for African businesses and consumers.,0.2779583,0.40699348,115
Apozy,Apozy makes every website safe to browse,0.4626171,0.40696582,9
Hogaru,Hogaru is a tech-enabled home services platform in Latin America. ,0.4264514,0.40990382,746
Plane,#1 easiest-to-use payroll for startups,0.36066023,0.34507236,30
Reliance Health,We make healthcare in emerging markets affordable and accessible,0.33012426,0.6052014,384
Solugen,Decarbonizing the chemicals industry.,0.42483065,0.5597345,200
Bulk MRO Industrial Supply,Full Stack Fintech and Supply Chain Platform for Global Trade,0.29128525,0.35888726,170
Inboxbooster,We Fix Email in Spam,0.4780143,0.33098447,3
Aella,Diversified credit infrastructure powering payments across Africa.,0.2734223,0.40550408,60
AlemHealth,AI Radiologist in a Box - We provide a vertically integrated AI…,0.39758313,0.71780556,25
Request Network,Request is a payment request technology & an ecosystem of apps,0.30715492,0.36956862,12
Collectly,We help healthcare orgs collect more money faster,0.34095854,0.60091835,106
Indee Labs,"Enabling T cell immunotherapy discovery, development and manufacturing",0.3299358,0.6678668,5
Tolemi,Data integration & insights for state and local governments,0.55641836,0.39822114,20
Wright Electric,Boeing for electric planes,0.49924988,0.56105053,4
Nomba,Banking and payments for businesses in Africa,0.27374217,0.40493873,200
Snappr,Snappr is the one-stop-shop for visual content creation,0.48749977,0.43871698,240
Mednet,Stack Overflow for Medicine,0.36477187,0.64616865,20
"Veryfi, Inc.",APIs to Liberate Trapped Data in Unstructured Documents,0.5806182,0.38137636,60
Token Transit,Complete fare payment platform for public transportation,0.3008572,0.40983427,12
RankScience,Automated SEO for Startups,0.68373525,0.47104636,16
The Essential,E-commerce 2.0,0.37693235,0.41358066,11
Ambient.ai,AI company transforming enterprise physical security to prevent…,0.6722696,0.4486499,95
Upcall,Upcall provides outbound call professionals as a service. ,0.4280886,0.40407577,6
Nuvola,"Nuvola is transforming battery manufacturing, making EV batteries…",0.43993393,0.54958296,4
Bitrise,Hosted Continuous Integration and Delivery for mobile apps,0.5225906,0.3325318,243
REZI,Rent Better,0.32582685,0.4422517,31
Ledger Investing,Marketplace for insurance securitization.,0.30293503,0.6006822,85
Extern,"Professional Experience Anytime, Anywhere.",0.4694209,0.3965563,30
Sleep Reset,Sleep Reset is a clinically proven CBT-i program for better sleep,0.39575455,0.6229131,8
Sinovia Technologies,Flexible printed OLED displays.,0.49110088,0.50790775,7
MDalgorithms Inc.,Democratizing Dermatology with AI ,0.39150718,0.71653616,25
BloomAPI,BloomAPI helps doctors share clinical data. Today most healthcare…,0.37238464,0.64349985,7
Speak,"A superhuman, AI-powered language tutor in your pocket",0.6572861,0.492847,40
Tizeti,ISP for Africa,0.31321293,0.44283655,0
Voiceops,We help B2C companies learn from every customer interaction,0.42368156,0.37257865,10
Humi,"Payroll, HR, and Health Benefits for Canada's SMB's",0.327741,0.39545962,141
ScopeAI,Automatically extract valuable insights from customer service…,0.72815984,0.53656965,4
Peer5,P2P delivery network that enables high quality video streaming,0.48430857,0.4401428,11
KidPass,Online & In-Person Kids Activities,0.52247316,0.4442871,21
Playment,Mechanical Turk for enterprises.,0.70954686,0.48910096,50
Terark,"Fastest Storage Engine with the Best Compression, we enables direct…",0.58549035,0.35038406,2
