name,tagline,pos_x,pos_y,team_size
Uplift AI,Foundational Voice AI for underserved languages,0.70510143,0.5627725,5
Paloma,Modular quoting and billing platform configured using natural language,0.5787121,0.42864868,3
Mobile Operator,AI agent that does QA on mobile apps,0.70369995,0.44886822,1
Nox Metals,"The modern factory for fast, low-cost metals. ",0.437396,0.5192523,2
Freya,Voice AI Agents For Financial Services And Other Regulated Industries,0.7614518,0.5414666,2
Luminal,Simple ML framework and cloud for generating fast GPU code.,0.6052797,0.38892534,3
RealRoots,RealRoots is a mobile app that guarantees women lifelong friendships.,0.46084034,0.43588957,4
Veritus Agent,AI agents for loan servicing and collections,0.7705199,0.5189054,5
Blue,The first voice assistant that can control every app on your phone.,0.46546748,0.45405966,3
Interfere,The self-healing layer of the internet,0.51612717,0.38676667,1
Outrove,AI-native Salesforce,0.71623886,0.5050422,2
NOSO LABS,Build AI agents for field technicians to diagnose and sell 10x better,0.71728635,0.48382226,3
Vulcan Technologies,AI regulatory drafting and compliance,0.7464342,0.48129272,3
TectoAI,Governance for AI Employees,0.74441123,0.48955783,2
Anytrace,The AI support engineering agent,0.7269538,0.4718322,2
Perspectives Health,Automating EMRs for frontline clinicians,0.40058488,0.6997934,4
Modelence,All-in-one TypeScript platform for startups,0.5324078,0.33374202,3
Magnetic,AI tax preparation for CPAs,0.7654837,0.50462115,2
Flywheel AI,Waymo for excavators,0.4483222,0.49239364,2
Fleetline,Optimizing fleet planning with data driven algorithms,0.43498757,0.5191207,2
Clodo,The AI Assistant for Real Estate Agents,0.75670713,0.53780174,3
stagewise,The frontend coding agent for production codebases,0.711989,0.42637578,2
burnt,Agentic Operating System for Food Supply Chain,0.70060253,0.5343465,3
Okibi,"Build agents using natural language, it's Lovable for agents",0.6892979,0.4398992,2
Kernel,High performance browsers-as-a-service for web agents & automations,0.7107335,0.40319553,5
dScribe AI,Track bulk inventory with autonomous drones and 3D vision,0.5803099,0.5359871,3
Daymi,Text your personal AI clone,0.71388197,0.45865622,3
Reacher,We help brands scale creator partnerships 10x faster,0.4263999,0.42330435,8
Nottelabs,Building infrastructure for reliable web agents,0.70724875,0.40189028,5
Certus AI,Replacing the restaurant phone line with Voice AI,0.71923834,0.5426746,3
Hera,AI Motion Designer,0.6537049,0.4965831,2
Pally,Pally is an AI Relationship Management Platform,0.7047146,0.46799707,3
Convexia,The world's first AI-maximalist pharma company,0.34124222,0.7152084,2
Locata,AI referral management for Health Centers,0.4049876,0.7401907,2
Opennote,The AI tutor that lives in your notes,0.64944243,0.46519044,3
SigmanticAI,Suite of AI Agents and Tools to Accelerate HDL Design,0.714989,0.4780658,2
F4,Automating compliance checks for engineering drawings,0.60419494,0.4715204,2
PARES AI,Helping commercial real estate brokers find and close more deals.,0.3543379,0.40755627,3
Altur,AI agents for debt collection and sales,0.7713206,0.509661,4
Sira,AI HR manager for hourly teams,0.7169763,0.4864195,0
Eden,We turn customer and brand data into campaigns that convert,0.4228462,0.39217383,2
Avelis Health,We audit medical claims for self-insured employers and health plans.,0.3292084,0.61431736,2
Idler,"AI employees that handle the work, so people can do the magic.",0.7374784,0.50042254,3
Juxta,Building a GPS alternative 100x more powerful with no hardware needed.,0.50731254,0.5300547,0
Floot,The easiest and most powerful way to build apps with AI.,0.69783384,0.46934092,2
Humoniq,Voice AI agents for customer support in travel,0.7455723,0.5357743,3
Observee,Access 1000+ MCP integrations with a single API,0.5357273,0.3319451,3
Risely AI,AI agents that automate administrative work across college campuses. ,0.7037888,0.4669714,9
April,Voice AI Executive Assistant,0.7278306,0.5603274,2
Autosana,QA agent for mobile apps,0.6778417,0.42220917,2
Socratix AI,AI coworkers for fraud and risk teams.,0.7445446,0.49207935,2
mcp-use,Open-source dev tools and infrastructure for MCP.,0.56650335,0.32614225,2
Motives,Qualitative consumer research run by AI,0.7020044,0.4897647,0
Omnara,The command center for your AI agents,0.7157676,0.4521218,2
Finto,AI accounting for enterprises,0.76811314,0.50098246,3
Iron Grid,AI Insurance for hardware.,0.40975803,0.76018727,2
Novaflow,The AI data analyst for biology labs,0.67135626,0.45841616,2
Phases,"Automating clinical trials with agents, starting in recruitment",0.36983967,0.7022605,3
Perseus Defense,Guided micro-missiles for Counter-UAS.,0.5309962,0.5438395,2
Summon,Open-Source Postman for MCP servers,0.5230209,0.3362941,2
Solva,Harvey for insurance,0.3060825,0.60178185,3
Riff,Cursor for music production,0.999896,0.34293333,2
Mohi,Analyze and understand complex agent workflows with clarity.,0.62641674,0.37295908,2
Albacore Inc.,Autonomous undersea vehicles to deter maritime invasions.,0.53590935,0.5510781,5
VibeFlow,Prompt to full stack app with visual workflows,0.52652603,0.34308454,0
Nozomio,"Engineers for AI era, starting with contextual layer for coding agents",0.70859253,0.4408403,1
GhostEye,The AI-powered human pentesting platform,0.6661681,0.3929401,3
Comena,AI agents for distributors and manufacturers to automate order entry.,0.72267777,0.52006644,2
Mimos,Helping regulated firms show up in AI search.,0.7477242,0.48244286,2
Channel3,Database of every product on the internet,0.41031384,0.41221067,2
Epicenter,"A database for your mind, built on plain text.",0.56177825,0.39966285,1
Candytrail,AI Agents that run your sales funnel and train your reps,0.72374666,0.5130447,2
Embedder,Cursor for Embedded,0.9999635,0.34289312,2
Flai,We Bring Customers to Your Dealership,0.3689108,0.47912407,3
b-12,Developing chemical super intelligence - one agent at a time.…,0.33059964,0.70277363,2
IronLedger.ai,AI agents for property accounting,0.7681537,0.52444166,2
Doe,Autonomous AI workforce for PE roll-ups,0.6895423,0.5039549,4
Parachute,"Evaluate, Deploy, and Monitor Clinical AI",0.39232808,0.7221447,2
BootLoop,"Firmware in minutes, not months - rigorously tested on real hardware",0.45676747,0.46566,2
Riverbank,AI Agents for Penetration Testing,0.7031003,0.4359522,2
Louiza Labs,Simulated human biology and synthetic medical datasets.,0.3647839,0.6936957,2
AgentHub,The simulation and evaluation engine for AI agents,0.69893336,0.43789336,2
Slashy,ChatGPT with Hands,0.5072707,0.41190124,3
Lemma,Specialized AI agents for professional services ,0.7333768,0.49953243,3
Wedge,The trust layer for health AI implementation.,0.4006693,0.7311133,2
CareSwift,AI operating system for ambulance agencies,0.6747348,0.49406466,3
Pangolin,Open-source identity-aware gateway to applications on private networks,0.6188598,0.33053052,2
DeepAware AI,Make AI data centers more efficient.,0.68671376,0.47762707,2
Sidekick,The simplicity of ChatGPT meets the power of Zapier,0.5224807,0.41076717,2
Kestroll,AI media asset management,0.64208925,0.47876582,2
DeepGrove,Frontier Intelligence. On Any Device.,0.5039021,0.41776845,2
Stockline,AI-native ERP for food wholesalers,0.6956347,0.53062004,2
Keystone,AI agents that test your application.,0.72281426,0.46294016,1
Frizzle,AI grading for math teachers,0.63028705,0.45528167,2
Skope,A modern billing system for AI-native companies.,0.74419546,0.5168242,2
Alter,Secure access control and authorization platform for agent workflows,0.62806773,0.34620526,2
Imprezia,The World's First AI-Native Ad Network.,0.6736087,0.48103613,1
Janet AI,The AI-Native Ticket Triage and Management Layer for Jira,0.6767271,0.4781103,2
Lilac,Open-Source MLOps platform ensuring your data scientists have GPUs,0.60743225,0.3745169,2
Qualify.bot,AI phone agents for Commercial Lending ,0.7700777,0.52774125,2
Cyberdesk,The computer use agent for developers to automate Windows apps,0.6504581,0.39243025,2
Nuntius,Automated infrastructure for model alignment.,0.6090602,0.40961835,2
Orange Slice,AI agents that find you customers who already want to buy,0.7416969,0.5113701,2
Monarcha,The AI GIS Platform ,0.6556022,0.4862009,2
Herdora,Cursor for CUDA,1.0,0.34289953,2
Lotas,Cursor for RStudio,0.99995095,0.34290206,2
Design Arena,World's largest crowdsourced benchmark for AI-generated design,0.65472835,0.4694309,3
Sentinel,AI on-call engineer,0.72911376,0.4774957,2
ContextFort,Automating drawing reviews for construction contractors,0.63508373,0.46022347,2
Pharmie AI,Your AI pharmacy technician,0.39163813,0.751021,2
Liva AI,Real voice and video data for AI,0.7033288,0.5538261,2
Ghostship,AI Agents that Find Bugs in Your Product,0.7209252,0.45475203,2
Shor,"The fastest, most affordable payroll for global teams",0.40754724,0.35276616,2
Verne Robotics,AI software for autonomous robot arms,0.6243756,0.5156819,2
Pond,Superhuman for text messages,0.5064108,0.40476325,2
Golpo,Most Powerful AI Video Gen Model for Explainer Videos From Documents,0.6032679,0.48014572,2
Async,A team of coding agents in your pocket,0.7065592,0.4202233,2
Lanesurf,Voice AI for booking freight,0.72554857,0.5349777,4
Gaus,Cursor for individual investors,0.32135504,0.32541907,2
TraceRoot.AI,AI agents automatically fix your production bugs,0.7144664,0.45391968,2
truthsystems,Building the unified governance layer for regulated industries,0.4581767,0.45929986,3
Acrely,"voice ai for realtors that answers, so you can close",0.7435478,0.5342284,3
Halluminate,Data and environments to train computer use AI,0.6727097,0.4627994,2
Blank Bio,Computational toolkit for RNA therapeutics ,0.31499115,0.6831015,3
AgentMail,Email Infrastructure for AI Agents,0.73488194,0.4438601,3
MangoDesk,We improve AI models by sourcing domain experts for data and evals.,0.66480166,0.4518102,2
Parametric,Robotics models for automating industries where errors can kill,0.6201482,0.52963114,2
Closera,AI employees for commercial real estate,0.7543618,0.54241806,2
Meteor,An AI-Native Browser,0.68312436,0.4424529,2
Pingo AI,AI companion that helps you learn languages,0.6696354,0.5012041,2
Synthetic Society,Synthetic Agents to Simulate Real Users,0.700948,0.42793158,2
Cactus,Deploy AI models locally on smartphones.,0.6958654,0.45562163,2
Fluidize,Helping scientists and engineers run experiments with AI. ,0.6583098,0.48501992,3
Nixo,The first ops platform built for FDEs,0.5825817,0.3374702,2
Autumn,Stripe for AI startups,0.73319733,0.49652153,2
Wayline,AI voice assistant for real estate managers,0.7533463,0.5475174,2
Ambral,AI-powered Account Managers,0.7216605,0.49955553,2
Rid,Sell with a text.,0.3880974,0.4089505,2
Cohesive,The agentic CRM for blue-collar services,0.43130058,0.3207861,2
Docket,AI agents for web testing,0.71196115,0.43461663,2
SAVA,Autonomous Factories for American Manufacturing,0.5735535,0.5449587,3
Godela,AI Physics Engine to replace simulations and prototypes,0.66239727,0.46940815,2
BitPatrol,AI-powered code security,0.6759284,0.42104632,1
Aegis,AI Agents to win denied health insurance claims.,0.4090821,0.7575292,3
sieve,AI + human review to solve data cleaning - accessible via API or Excel,0.65615463,0.43140692,2
Bond,"Building Donna, your AI Chief of Staff",0.71570307,0.48542154,2
Blueshoe,The AI-native legal back office,0.75814384,0.46949103,2
Theorem,Program verification so even your systems engineers can vibecode,0.54816717,0.36235955,2
Airweave,Open-Source Tool That Lets Agents Search Any App,0.6775551,0.4035287,3
Cascade Space,Deep space communications as a service,0.5061756,0.533065,3
text.ai,AI in your group chats,0.71353465,0.474374,3
StarSling,Cursor for DevOps,0.9998086,0.34297466,2
Wavedash,Play the latest games in your browser with no downloads,0.49636889,0.44215047,3
Cactus,AI copilot for solopreneurs,0.33367673,0.3247099,2
mlop,Experiment tracking for training ML models,0.6123249,0.43111676,2
Code Four,Modernizing the police workflow.,0.5943691,0.37075683,3
Propolis,Hands off QA via intelligent browser agents. ,0.701145,0.41522324,2
LineWise,AI Engineer to troubleshoot manufacturing line issues,0.66616267,0.51045877,5
Den,Cursor for knowledge workers,0.99879926,0.3434104,2
Lumari,Agentic internal tools,0.708417,0.42074963,2
Cotool,AI Agents for Security Operations Teams,0.70546776,0.44501603,3
Delty,AI staff engineer: software architect that leads coding agents,0.70821184,0.44369173,2
Nimbic AI,Automatically write and update internal docs with every code commit.,0.55594766,0.360824,3
Moby Analytics,AI financial auditors,0.76688135,0.50087357,4
Rimba,AI to replace manual work in environmental compliance reporting,0.69227237,0.48481062,4
Probo,We help you get compliant while you focus on your business.,0.40365982,0.38023993,2
chrt,chrt is a logistics platform for time-critical shipping,0.34194225,0.4785161,2
Mesmer,Cursor for CTOs,0.9999875,0.34288067,3
Lapel,Scale personalized service to every customer.,0.41820613,0.4189658,2
MindFort,Autonomous Security Agents,0.6959612,0.42815495,3
WorkDone Health,Real-time AI Compliance for Medical Documentation,0.39942735,0.72656244,4
Relixir,Content Automation for AI Search Visibility,0.6747772,0.44807547,2
Janus,Battle-Test AI Agents with Human Simulation,0.69932294,0.43838394,2
Zero,AI powered email client that manages your email so you don't have to.,0.48508495,0.31510875,2
Hemut,AI-powered operating system for trucking companies.,0.685217,0.528323,3
ValueMate,Valuemate automates real estate appraisals with AI ,0.7565691,0.5376347,2
Eloquent AI,The AI Operator for Financial Services,0.7766892,0.5017141,5
MorphoAI,Software tool for designing robots and machines ,0.5864006,0.5273385,5
Bramante Biologics,American drug manufacturing,0.38338044,0.56975704,2
Scalar Field,Reinventing the trading terminal — one intelligent agent at a time.,0.7354468,0.4891575,3
Vassar Robotics,Ultra-affordable robots that are practical and accessible today.,0.5737991,0.54150003,3
Boost Robotics,Robots for the inspection and maintenance of data centers,0.585852,0.52882344,2
Sygaldry Technologies,quantum-accelerated AI servers,0.6558732,0.46169955,0
ParaQuery,Managed GPU-accelerated Spark + SQL at 2x speed and half the cost,0.605018,0.37866765,1
Klavis AI,Open Source MCP Integrations for AI Applications,0.65692407,0.46645403,2
Third Chair,Agents for in-house legal teams,0.41295204,0.35808456,2
Vesence,Cursor for Lawyers. Agentic AI in MS Office.,0.75745785,0.46139443,2
PowerMatrix,Efficient and compact power supply for AI hardware,0.632192,0.48233762,2
Jazzberry,Training LLMs to be expert bug finders,0.5885173,0.3337966,2
Besimple AI,AI powered data annotation,0.6499551,0.4305307,2
QualGent,AI Mobile App Quality Assurance Tester,0.6852306,0.44649652,6
Human Behavior,Understand your users beyond the numbers,0.4728074,0.37626868,3
Novoflow,AI employees that automate medical operations for clinics. ,0.4000848,0.7275247,2
Alkali,Your Copilot for Building Chemical Projects,0.47326487,0.49739268,2
Prism AI,AI-native Datadog + Amplitude,0.63702995,0.4864897,3
Theta Software,Self-Learning for AI Agents,0.6938764,0.43120456,3
Lyra,AI-Native Zoom For Revenue Teams,0.71795815,0.517998,4
Cleon,AI Agents for Software Implementations,0.72516245,0.4564937,3
throxy,Vertical AI agents that run the sales funnel on autopilot,0.7218959,0.51440495,4
Flott HQ,AI-native operating system for vehicle fleet management,0.68297905,0.5297488,2
Crimson,The AI Associate for Litigation Lawyers,0.7661455,0.46645844,3
Casco,"Evaluate AI agents and apps on security, safety, and accuracy.",0.70831317,0.43660316,2
Lucis,Function Health for Europe ,0.36859372,0.627719,3
RunRL,Reinforcement learning as a service,0.67303836,0.42274922,2
Nomi,Cursor for Sales,0.99988645,0.34282243,2
Morphik,Open-source multimodal search for AI apps,0.6723906,0.45230916,2
Kaizen,Integrate instantly with any website.,0.524435,0.33543497,3
HABIT,Reshaping neighborhood services with robotics.,0.57393295,0.54025066,2
Ticket Wallet,AI-optimized ticket resale,0.71152645,0.5080203,2
Clidey,Documentation made for AI Agents,0.70452976,0.44187012,3
Opusense AI,AI for Field Inspection Reports,0.6612639,0.48607293,2
Labric,The data layer for scientific research,0.568737,0.41089332,2
Odapt,How great teams build internal software & agent workflows,0.51964855,0.36001697,3
Clado,Deep Research for People,0.53502715,0.4363679,7
Photonium,AI-Driven Optical System Design,0.6312241,0.49609414,2
Sixtyfour,Bloomberg for Sales,0.38069195,0.3829443,2
Combinely,AI coworker for accountants,0.7458153,0.49850103,2
Jeevy Fabrication,AI Driven EPC - Weld Fabrication Contractor,0.65986335,0.512923,3
Chiron,Grammarly for Math ✏️,0.5470926,0.41849256,2
VoiceOS,Voice AI Interviews for Enterprise,0.72817796,0.5565357,4
Trapeze,AI-native Zocdoc,0.65254384,0.47221544,2
Tinfoil,"Tinfoil makes your AI workflows secure, verifiable, and private.",0.6098715,0.35217622,4
Operative,AI Infrastructure for autonomous software creation and interaction,0.6794544,0.46246472,2
Better Auth,The authentication framework for TypeScript,0.61950696,0.33100674,2
The LLM Data Company,Datagen Tooling for Evals & RL,0.58507997,0.35887635,3
Parsewise,Business Analytics for Unstructured Data,0.56993395,0.39422098,2
Kestral,AI Agents that prioritize the highest impact work across Sales and R&D,0.7204343,0.5060573,2
Attune,"Faster builds, zero effort.",0.49571463,0.3968322,2
PgDog,Scaling engine for PostgreSQL,0.5922053,0.3726748,1
Bluejay,The world's first quality assurance agency for voice AI.,0.7287982,0.56461656,2
Kirana AI,AI manager for physical stores,0.7092289,0.52876055,2
YouLearn,AI tutor for each student. ,0.64684415,0.47094566,3
Percival,AI-powered data entry for wholesalers and distributors,0.71503466,0.53006107,2
Caucus,AI CRM for Government,0.74222785,0.4997736,3
VibeGrade,Cursor for Teachers,0.9996713,0.34302804,2
Mbodi AI,Embodied AI Platform for Industrial Robotics,0.64023185,0.5089544,3
stratify,AI agents that help you understand your customers' needs,0.7406376,0.5082875,2
Clarm,Perplexity for internal docs,0.55358475,0.3842843,2
Sim,Open source platform to build AI agent workflows,0.70733744,0.43836212,2
Kaelio,AI operating system for healthcare organizations,0.40355384,0.73511,2
Beluga Labs,Rippling for Content Creators,0.46998534,0.4404863,2
Zenobia Pay,Bank transfers as payments for luxury retailers.,0.30981722,0.3865776,2
HelixDB,"The best database for building AI applications, agents & RAG ",0.6865828,0.44301486,2
Chonkie,Open Source Data Ingestion For AI,0.66974336,0.44195008,2
The Robot Learning Company,Affordable robotic workers,0.57606465,0.5417287,1
Zeon Systems,AI-powered robotics for scientific lab automation.,0.61302245,0.5227415,2
Claim Health,The first AI revenue platform for post-acute healthcare,0.4047477,0.73876435,2
Almond,AI robots for manufacturing,0.62785006,0.52491796,2
Approval AI,"One-click mortgage: AI shops, negotiates, and handles your application",0.7672607,0.5188327,2
Anvil,Anvil is the SEO platform for the AI era,0.6788596,0.45532337,2
Capacitive,The AI Agent Platform for Knowledge Workers.,0.7182586,0.46887243,2
neoncoral,🪸 AI consumer social ,0.69617605,0.49209285,1
Auctor,Automating Enterprise Software Implementations,0.5888307,0.36356026,4
SynthioLabs,Voice AI Medical Rep for Pharma,0.40143567,0.74213487,3
Galen AI,"Personal AI healthcare agent, powered by clinical and wearable data.",0.39952958,0.72986275,2
Minerva,AI to Replace SMB Bookkeepers,0.71817493,0.48836687,2
Kanava AI,Your First AI Sales Hire for Wholesale Distributors,0.7340193,0.51747996,2
Cua,Docker for Computer-use Agents,0.6806765,0.40174776,3
GroundControl,Vertical AI for highly-regulated manufacturing,0.6882949,0.5068736,4
Bloom,Build and share mobile apps in seconds,0.50629115,0.36679456,2
BitBoard,The AI workforce for healthcare operations.,0.40362877,0.737065,2
Notus Autonomous Systems,Swarm robotics and full AI-command hierarchy integration,0.63161653,0.49835008,2
Avallon AI,AI agents for insurance claims operations,0.41084024,0.7630645,3
Golf,Open-source platform for building production MCP servers,0.5516498,0.32545203,2
cubic,AI-powered code review platform,0.6686342,0.44194958,2
nao Labs,Cursor for data teams.,0.99897116,0.34326315,2
Vybe,Lovable for internal apps,0.5061164,0.34552503,2
Plexe,Open-source agents to build predictive ML models from a prompt,0.68799263,0.43679345,2
Kashikoi,Simulation Engine for Benchmarking AI Products,0.6791971,0.46559057,2
Chestnut,The first AI mortgage lender,0.7723945,0.5264038,1
QFEX,24/7 Global Stock Exchange,0.29802355,0.3669883,7
Aravolta,"Software to monitor, control, and optimize data centers.",0.5893918,0.34544346,3
Atlog,Voice Agents for Physical Retail Stores,0.73107356,0.55611277,3
Frekil,Scale AI for Medical Scans,0.39169553,0.7170659,2
Waffle,AI Game Builder,0.67891496,0.44276917,2
Blaxel,AWS for AI Agents,0.7186097,0.4450682,6
Partcl,Design a chip in minutes,0.5426551,0.4777562,2
Tropir,The AI that builds better AIs,0.70425975,0.46709096,2
Willow,The voice interface replacing your keyboard,0.5500187,0.4646342,2
Atum Works,Gigascale Nanomanufacturing,0.49475464,0.5044789,3
Red Barn Robotics,A Roomba for weeds on a farm. ,0.38303557,0.5286432,3
Leeroo,Continuously Learning AI Agents,0.6922028,0.43566883,3
Fira,Agentic AI platform for investment firms,0.7786913,0.49962702,2
Vantel,AI Software for Commercial Insurance Brokers,0.41202995,0.76593316,2
Mentra,Building the open source smart glasses operating system.,0.49725488,0.46572888,4
BlindPay,Stablecoin API for global payments,0.26630834,0.35408568,4
Artifact,"An Collaborative, AI-native IDE for Hardware Engineers",0.64793086,0.4786135,3
assistant-ui,Open Source React.js Library for AI Chat,0.55935806,0.45345464,1
Axal,The AI Software Architect ,0.69586897,0.4594461,2
TrainLoop,Reasoning Fine-Tuning,0.6246424,0.43651935,2
SAMMY Labs,"Live, AI-powered graph of every possible click path in your software",0.5670643,0.38027307,3
Mercura,AI Quote and Order Automation for Distributors & Manufacturers,0.71286875,0.5328903,14
Instinct,Building the lunar future. ,0.4970965,0.5372273,4
Cedar,The best way to build In-product AI copilots for your app,0.6963065,0.47689676,2
ThirdLayer,"Building Dex, the AI Browser Copilot",0.66258585,0.46346852,2
Tally,Assurance and audit AI,0.7592697,0.4906719,2
TamLabs,Cursor for Microsoft Word,0.99995863,0.3428993,2
emojis.com,AI Copilot for Graphic Design,0.6540621,0.49481153,2
Browser Use,Leading open-source web agent project with 50k stars in 3 months,0.7112653,0.40113413,2
CopyCat,The AI RPA - Powered by Browser Agents,0.70347,0.42391804,3
TensorPool,Vercel For GPUs,0.58758754,0.38266894,3
Paratus Health,AI-powered intake nurse,0.39742634,0.72011584,6
Butter,Behavioral Cache for Agents,0.7022204,0.40649617,1
Bluebook,AI for accounting,0.7709503,0.5030795,4
Ergo,AI Agents for Sales Operations,0.7312634,0.51821846,0
Dalus,AI-Powered Hardware System Design Software,0.6319282,0.4905291,3
Rebolt,AI Agents to Replace Restaurant Managers,0.72313833,0.4930301,2
Roark,Datadog for Voice AI,0.7045434,0.5570667,2
Spott,AI-native ATS/CRM for recruiting firms,0.71039283,0.5008471,11
Woz,AI platform enabling anyone to build and scale software businesses,0.6955065,0.47212124,6
Demeter,AI Value Creation Team for Private Equity,0.7865876,0.499892,2
Proception Inc,Making humanoids dexterous enough to thread a needle,0.46537647,0.48526654,5
Wildcard,Coding Agents for Engineering Managers,0.71855825,0.43500435,2
Reditus Space,Reusable Satellites for zero-g manufacturing,0.50482583,0.53040564,10
Optifye.ai,AI performance monitoring for factory workers,0.66159916,0.5150198,8
Permitify,AI co-pilot for building plan review and building code compliance,0.6847367,0.509769,2
Archon,We help software companies sell to government.,0.4027865,0.39646465,3
Retrofit,A vintage marketplace curated by AI,0.67711747,0.50233334,2
Pinch,Video conferencing with real-time voice translation,0.5423695,0.46467966,3
Forge Automation,Software Enabled CNC Parts Supplier,0.5677681,0.4793422,9
Mastra,"The Javascript framework for building AI agents, from the Gatsby devs",0.70346624,0.44186395,8
Misprint,Misprint is building Robinhood for Pokemon cards,0.33010736,0.3855742,5
AfterQuery,Research lab investigating the boundaries of AI capabilities.,0.6785274,0.47274154,3
TripleZip,Automating CRE accounting with AI,0.76895124,0.5026766,2
Artificial Societies,We use AI to simulate entire human societies,0.6282358,0.4759465,3
Infinite,Global B2B Stablecoin Processor,0.25913233,0.34806344,2
Sennu AI,Hands off Salesforce QA,0.39726225,0.353567,2
Miyagi Labs,Shopify for AI-generated courses,0.68829894,0.510025,2
Peppr AI,Self-improving knowledge base synthesizing scattered company data,0.5578436,0.40071914,4
Mesh,Building your AI finance co-worker,0.757502,0.49972564,2
Orbital Operations,High Thrust Space Vehicles for Satellite Defense,0.5145258,0.5510583,2
FuseAI,The only sales software you will ever need. ,0.41163415,0.36555308,5
Outlit,AI Quoting and Proposals,0.67335075,0.4636955,2
Tire Swing,AI for Healthcare Compliance,0.40356177,0.73587614,2
Calltree AI,Enterprise-grade AI support reps for call centers,0.76607823,0.5129425,2
Harper,AI-native commercial insurance brokerage,0.4111572,0.7645347,8
Waypoint Transit,We automate urban planning so cities can build cheaper and faster.,0.4204022,0.49313134,2
Riviera,AI Employees for Hotels,0.74281865,0.5127339,2
Exla,An SDK to run transformer models anywhere,0.5942591,0.40909523,0
Nitrode,AI game development engine & platform,0.6747461,0.4473179,4
Karsa,Stablecoin neobank for emerging markets,0.2672743,0.35570005,2
Confident AI,Open-Source Unit Testing for LLM Applications,0.5841073,0.31503037,2
Bystreet,Automate deal origination with AI agents. ,0.7309714,0.44524482,4
Agentin AI,AI Agents that automate enterprise software processes,0.7364939,0.45457256,2
ReJot,Sync engine to share data across engineering teams in enterprises,0.5448703,0.35341182,2
